-- phpMyAdmin SQL Dump
-- version 5.2.1
-- https://www.phpmyadmin.net/
--
-- Host: 127.0.0.1:3306
-- Generation Time: Sep 05, 2023 at 02:59 PM
-- Server version: 5.7.43
-- PHP Version: 7.4.33

SET SQL_MODE = "NO_AUTO_VALUE_ON_ZERO";
START TRANSACTION;
SET time_zone = "+00:00";


/*!40101 SET @OLD_CHARACTER_SET_CLIENT=@@CHARACTER_SET_CLIENT */;
/*!40101 SET @OLD_CHARACTER_SET_RESULTS=@@CHARACTER_SET_RESULTS */;
/*!40101 SET @OLD_COLLATION_CONNECTION=@@COLLATION_CONNECTION */;
/*!40101 SET NAMES utf8mb4 */;

--
-- Database: `bettergl_evaluation`
--

-- --------------------------------------------------------

--
-- Table structure for table `competences`
--

CREATE TABLE `competences` (
  `id` bigint(20) UNSIGNED NOT NULL,
  `competence_skill` varchar(255) COLLATE utf8mb4_unicode_ci NOT NULL,
  `created_at` timestamp NULL DEFAULT NULL,
  `updated_at` timestamp NULL DEFAULT NULL
) ENGINE=InnoDB DEFAULT CHARSET=utf8mb4 COLLATE=utf8mb4_unicode_ci;

--
-- Dumping data for table `competences`
--

INSERT INTO `competences` (`id`, `competence_skill`, `created_at`, `updated_at`) VALUES
(1, 'Self-Motivation', NULL, NULL),
(2, 'Drive for Results', NULL, NULL),
(3, 'Planning and organizing', NULL, NULL),
(4, 'Decision Making', NULL, NULL),
(5, 'Knowledge Management', NULL, NULL),
(6, 'Initiative', NULL, NULL),
(7, 'Honesty/integrity', NULL, NULL),
(8, 'Efficiency', NULL, NULL),
(9, 'Teamwork', NULL, NULL),
(10, 'Managing Relationships', NULL, NULL),
(11, 'Managing People', NULL, NULL),
(12, 'Punctuality', NULL, NULL),
(13, 'Expediency', NULL, NULL),
(14, 'Reliability', NULL, NULL),
(15, 'Ability to follow instructions', NULL, NULL),
(16, 'Attitude', NULL, NULL),
(17, 'Communication', NULL, NULL);

-- --------------------------------------------------------

--
-- Table structure for table `drop_data`
--

CREATE TABLE `drop_data` (
  `id` bigint(20) UNSIGNED NOT NULL,
  `type` varchar(255) COLLATE utf8mb4_unicode_ci NOT NULL,
  `dropdown_item` varchar(255) COLLATE utf8mb4_unicode_ci NOT NULL,
  `created_at` timestamp NULL DEFAULT NULL,
  `updated_at` timestamp NULL DEFAULT NULL
) ENGINE=InnoDB DEFAULT CHARSET=utf8mb4 COLLATE=utf8mb4_unicode_ci;

--
-- Dumping data for table `drop_data`
--

INSERT INTO `drop_data` (`id`, `type`, `dropdown_item`, `created_at`, `updated_at`) VALUES
(1, 'achieved', 'External Training', '2021-10-22 09:22:21', '2021-10-22 09:22:21'),
(2, 'achieved', 'Internal Training', '2021-10-22 09:22:43', '2021-10-22 09:22:43'),
(3, 'achieved', 'Self Study', '2021-10-22 09:24:38', '2021-10-22 09:24:38'),
(4, 'responsible', 'Myself', '2021-10-22 09:39:59', '2021-10-22 09:39:59'),
(5, 'responsible', 'Supervisor', '2021-10-22 09:40:12', '2021-10-22 09:40:12'),
(6, 'responsible', 'Internal Trainer', '2021-10-22 09:40:24', '2021-10-22 09:40:24'),
(65, 'Skill', 'Agribusiness approach to tree planting', '2021-10-23 19:21:20', '2021-10-23 19:21:20'),
(66, 'Skill', 'Agroforesrty ,crops and tree husbandry', '2021-10-23 19:21:32', '2021-10-23 19:21:32'),
(67, 'Skill', 'Agroforestry technics in ASALs', '2021-10-23 19:21:39', '2021-10-23 19:21:39'),
(68, 'Skill', 'Basic agroforestry practice.', '2021-10-23 19:21:51', '2021-10-23 19:21:51'),
(69, 'Skill', 'Basic techniques in construction of farm water conservation structures', '2021-10-23 19:21:58', '2021-10-23 19:21:58'),
(70, 'Skill', 'Chemical application & mixing', '2021-10-23 19:22:05', '2021-10-23 19:22:05'),
(71, 'Skill', 'Compartment stock assessment', '2021-10-23 19:22:15', '2021-10-23 19:22:15'),
(72, 'Skill', 'Conflict management and resolution', '2021-10-23 19:22:25', '2021-10-23 19:22:25'),
(73, 'Skill', 'Demarcation & Tree counting', '2021-10-23 19:22:34', '2021-10-23 19:22:34'),
(74, 'Skill', 'Digital farmers management system', '2021-10-23 19:22:43', '2021-10-23 19:22:43'),
(75, 'Skill', 'Excel- Database manipulation & formulas, Sorting & filtering data, Linking data, Creating analysis tables, Creating charts', '2021-10-23 19:22:50', '2021-10-23 19:22:50'),
(76, 'Skill', 'farmer group management & dynamics; Conflict Resolution & management', '2021-10-23 19:22:57', '2021-10-23 19:22:57'),
(77, 'Skill', 'Forest fire management', '2021-10-23 19:23:03', '2021-10-23 19:23:03'),
(78, 'Skill', 'Group Management and Group dynamics.', '2021-10-23 19:23:13', '2021-10-23 19:23:13'),
(79, 'Skill', 'Herbicide spraying', '2021-10-23 19:23:20', '2021-10-23 19:23:20'),
(80, 'Skill', 'IGAs and community empowerment strategies', '2021-10-23 19:23:27', '2021-10-23 19:23:27'),
(81, 'Skill', 'Melia establishment & Management (spacing,planting, pruning, protection)', '2021-10-23 19:23:34', '2021-10-23 19:23:34'),
(82, 'Skill', 'Modern agroforestry', '2021-10-23 19:23:45', '2021-10-23 19:23:45'),
(83, 'Skill', 'Moringa management, harvesting & processing', '2021-10-23 19:23:52', '2021-10-23 19:23:52'),
(84, 'Skill', 'Moringa processing', '2021-10-23 19:23:57', '2021-10-23 19:23:57'),
(85, 'Skill', 'Mulching', '2021-10-23 19:24:04', '2021-10-23 19:24:04'),
(86, 'Skill', 'Nursery hygiene', '2021-10-23 19:24:10', '2021-10-23 19:24:10'),
(87, 'Skill', 'Organising and managing farmers groups', '2021-10-23 19:24:16', '2021-10-23 19:24:16'),
(88, 'Skill', 'Persuading,negotiating and influencing skills', '2021-10-23 19:24:23', '2021-10-23 19:24:23'),
(89, 'Skill', 'Pest & disease control/management', '2021-10-23 19:24:29', '2021-10-23 19:24:29'),
(90, 'Skill', 'Pitting', '2021-10-23 19:24:35', '2021-10-23 19:24:35'),
(91, 'Skill', 'Plant pathology(Identification and treatment of diseases causing mortality in the nursery)', '2021-10-23 19:24:44', '2021-10-23 19:24:44'),
(92, 'Skill', 'Pruning', '2021-10-23 19:24:54', '2021-10-23 19:24:54'),
(93, 'Skill', 'Record keeping', '2021-10-23 19:25:00', '2021-10-23 19:25:00'),
(94, 'Skill', 'Seedling damage assessment (game, fire)', '2021-10-23 19:25:09', '2021-10-23 19:25:09'),
(95, 'Skill', 'Seedling production', '2021-10-23 19:25:17', '2021-10-23 19:25:17'),
(96, 'Skill', 'Task rate management', '2021-10-23 19:25:27', '2021-10-23 19:25:27'),
(97, 'Skill', 'Thinning', '2021-10-23 19:25:34', '2021-10-23 19:25:34'),
(98, 'Skill', 'Tree counting', '2021-10-23 19:25:40', '2021-10-23 19:25:40'),
(99, 'Skill', 'Water and soil conservation', '2021-10-23 19:25:46', '2021-10-23 19:25:46'),
(100, 'Skill', 'Weeding', '2021-10-23 19:25:53', '2021-10-23 19:25:53'),
(101, 'Skill', 'Importance of Communication', '2021-10-23 19:25:59', '2021-10-23 19:25:59'),
(102, 'Skill', 'Types of Communication ', '2021-10-23 19:26:09', '2021-10-23 19:26:09'),
(103, 'Skill', 'Timely Communication', '2021-10-23 19:26:15', '2021-10-23 19:26:15'),
(104, 'Skill', 'Effective Listening', '2021-10-23 19:26:22', '2021-10-23 19:26:22'),
(105, 'Skill', 'Effective Instructions', '2021-10-23 19:26:29', '2021-10-23 19:26:29'),
(106, 'Skill', 'Leading by Example', '2021-10-23 19:26:35', '2021-10-23 19:26:35'),
(107, 'Skill', 'Induction training', '2021-10-23 19:26:43', '2021-10-23 19:26:43'),
(108, 'Skill', 'Managerial training', '2021-10-23 19:26:49', '2021-10-23 19:26:49'),
(109, 'Skill', 'Managerial training-effective delegation', '2021-10-23 19:26:58', '2021-10-23 19:26:58'),
(110, 'Skill', 'Managerial training-Ways to maintain motivation in your team', '2021-10-23 19:27:04', '2021-10-23 19:27:04'),
(111, 'Skill', 'Managerial training-Planning and organizing', '2021-10-23 19:27:11', '2021-10-23 19:27:11'),
(112, 'Skill', 'Time management', '2021-10-23 19:27:17', '2021-10-23 19:27:17'),
(113, 'Skill', 'Health and safety training- Workplace safety(OSHA)', '2021-10-23 19:27:23', '2021-10-23 19:27:23'),
(114, 'Skill', 'Leadership-Effective leadership', '2021-10-23 19:27:29', '2021-10-23 19:27:29'),
(115, 'Skill', 'Leadership-Leading by example', '2021-10-23 19:27:36', '2021-10-23 19:27:36'),
(116, 'Skill', 'CAT maintenance Training', '2021-10-23 19:27:46', '2021-10-23 19:27:46'),
(117, 'Skill', 'Fire extinguisher operation', '2021-10-23 19:27:52', '2021-10-23 19:27:52'),
(118, 'Skill', 'First AID training-in handling chemical poisoning instances', '2021-10-23 19:27:59', '2021-10-23 19:27:59'),
(119, 'Skill', 'First Aid Training-First AID administration', '2021-10-23 19:28:08', '2021-10-23 19:28:08'),
(120, 'Skill', 'Motorbike basic mechanic skills', '2021-10-23 19:28:14', '2021-10-23 19:28:14'),
(121, 'Skill', 'Drone training', '2021-10-23 19:28:23', '2021-10-23 19:28:23'),
(122, 'Skill', 'Security training', '2021-10-23 19:28:30', '2021-10-23 19:28:30'),
(123, 'Skill', 'Security training-Discipline in security', '2021-10-23 19:28:37', '2021-10-23 19:28:37'),
(124, 'Skill', 'Welding Training', '2021-10-23 19:28:45', '2021-10-23 19:28:45'),
(125, 'Skill', 'Mechanical pruning training', '2021-10-23 19:28:52', '2021-10-23 19:28:52'),
(126, 'Skill', 'Record keeping-Effective records', '2021-10-23 19:28:59', '2021-10-23 19:28:59'),
(127, 'Skill', 'Writing and Editing – English', '2021-10-23 19:29:05', '2021-10-23 19:29:05'),
(128, 'Skill', 'Web Design', '2021-10-23 19:29:14', '2021-10-23 19:29:14'),
(129, 'Skill', 'Soil Microbiology', '2021-10-23 19:29:20', '2021-10-23 19:29:20'),
(130, 'Skill', 'English-Grammar', '2021-10-23 19:29:27', '2021-10-23 19:29:27'),
(131, 'Skill', 'Excel- Use of dashboards for reporting site results and monitoring', '2021-10-23 19:29:34', '2021-10-23 19:29:34'),
(132, 'Skill', 'Data and Knowledge management skills: Keeping records of reports and reference materials.', '2021-10-23 19:29:42', '2021-10-23 19:29:42'),
(133, 'Skill', 'Data collection methods, tools, and approaches', '2021-10-23 19:29:50', '2021-10-23 19:29:50'),
(134, 'Skill', 'BGF quality standards and procedures', '2021-10-23 19:29:57', '2021-10-23 19:29:57'),
(135, 'Skill', 'Continuous improvement and measurement of improvement(Indicators)', '2021-10-23 19:30:04', '2021-10-23 19:30:04'),
(136, 'Skill', 'Communication Mechanism', '2021-11-10 12:11:25', '2021-11-10 12:11:25'),
(137, 'Skill', 'None', '2021-11-10 12:32:00', '2021-11-10 12:32:00'),
(138, 'achieved', 'N/A', '2021-11-10 12:32:40', '2021-11-10 12:32:40'),
(139, 'responsible', 'N/A', '2021-11-10 12:32:55', '2021-11-10 12:32:55'),
(140, 'Skill', 'Delegating', '2021-11-11 07:14:23', '2021-11-11 07:14:23'),
(142, 'Skill', 'Microsoft Project', '2021-11-12 11:26:16', '2021-11-12 11:26:16'),
(143, 'Skill', 'Carbon sequestration', '2021-11-12 11:28:13', '2021-11-12 11:28:13'),
(144, 'Skill', 'Ticketing system', '2021-11-12 11:28:45', '2021-11-12 11:28:45'),
(145, 'Skill', 'CAR system', '2021-11-12 11:29:38', '2021-11-12 11:29:38'),
(146, 'Skill', ' IPR system', '2021-11-12 11:29:53', '2021-11-12 11:29:53'),
(147, 'Skill', 'Machine maintenance system', '2021-11-12 11:30:20', '2021-11-12 11:30:20'),
(148, 'Skill', 'Time capture', '2021-11-12 11:30:34', '2021-11-12 11:30:34'),
(149, 'Skill', 'Farmers programme back office', '2021-11-12 11:31:23', '2021-11-12 11:31:23'),
(150, 'Skill', 'Farmers programme front office', '2021-11-12 11:31:27', '2021-11-12 11:31:27'),
(151, 'Skill', 'Clock in devices', '2021-11-12 11:31:46', '2021-11-12 11:31:46'),
(152, 'Skill', 'Vue JS', '2021-11-12 12:49:48', '2021-11-12 12:49:48'),
(153, 'Skill', 'Addressing New challenges', '2021-11-12 12:52:46', '2021-11-12 12:52:46'),
(158, 'Skill', 'Sage Accounting', '2021-11-17 13:19:10', '2021-11-17 13:19:10'),
(159, 'Skill', 'International Financial reporting standards (IFRS)', '2021-11-17 13:19:23', '2021-11-17 13:19:23'),
(160, 'Skill', 'International accounting standards (IAS)', '2021-11-17 13:19:40', '2021-11-17 13:19:40'),
(161, 'Skill', ' Taxation', '2021-11-17 13:20:06', '2021-11-17 13:20:06'),
(162, 'Skill', 'Report writing', '2021-11-18 12:56:28', '2021-11-18 12:56:28'),
(163, 'Skill', 'Interacting with professionals in the same field', '2021-11-18 13:31:46', '2021-11-18 13:31:46'),
(164, 'Skill', 'Diploma or Degree in my field', '2021-11-18 13:33:37', '2021-11-18 13:33:37'),
(165, 'Skill', 'Drivers License', '2022-11-14 16:30:39', '2022-11-14 16:30:39'),
(166, 'Skill', 'Planning and Budgeting', '2022-11-14 16:35:22', '2022-11-14 16:35:22'),
(167, 'Skill', 'Financial Management', '2022-11-22 14:39:55', '2022-11-22 14:39:55'),
(168, 'Skill', 'Editing', '2022-11-26 15:08:39', '2022-11-26 15:08:39');

-- --------------------------------------------------------

--
-- Table structure for table `extra_information`
--

CREATE TABLE `extra_information` (
  `id` bigint(20) UNSIGNED NOT NULL,
  `user_id` bigint(20) UNSIGNED NOT NULL,
  `status` varchar(255) COLLATE utf8mb4_unicode_ci NOT NULL DEFAULT 'pending',
  `evaluation_type` varchar(255) CHARACTER SET utf8 COLLATE utf8_unicode_ci DEFAULT NULL,
  `Academic` varchar(255) COLLATE utf8mb4_unicode_ci NOT NULL,
  `Designation` varchar(255) COLLATE utf8mb4_unicode_ci NOT NULL,
  `service_years` varchar(255) COLLATE utf8mb4_unicode_ci NOT NULL,
  `review_supervisor` varchar(255) COLLATE utf8mb4_unicode_ci NOT NULL,
  `review_manager` bigint(20) DEFAULT NULL,
  `review_hod` varchar(255) COLLATE utf8mb4_unicode_ci DEFAULT NULL,
  `review_period` varchar(255) COLLATE utf8mb4_unicode_ci NOT NULL,
  `last_appraisal` text COLLATE utf8mb4_unicode_ci NOT NULL,
  `created_at` timestamp NULL DEFAULT NULL,
  `updated_at` timestamp NULL DEFAULT NULL
) ENGINE=InnoDB DEFAULT CHARSET=utf8mb4 COLLATE=utf8mb4_unicode_ci;

--
-- Dumping data for table `extra_information`
--

INSERT INTO `extra_information` (`id`, `user_id`, `status`, `evaluation_type`, `Academic`, `Designation`, `service_years`, `review_supervisor`, `review_manager`, `review_hod`, `review_period`, `last_appraisal`, `created_at`, `updated_at`) VALUES
(4, 93, 'HOD reviewed', 'yearly', 'Diploma in Forestry', 'Forest Technician Plantation Nyongoro', '4.9', '119', NULL, '4', '10/30/2020 - 10/30/2021', '72', '2021-10-30 10:01:28', '2021-11-20 04:49:28'),
(5, 14, 'HOD reviewed', 'yearly', 'Diploma in Forestry', 'Agroforestry Agent 7Forks', '3', '3', NULL, '4', '10/30/2020 - 10/30/2021', '10/30/2020', '2021-10-30 18:45:44', '2021-11-11 09:22:46'),
(7, 12, 'HOD reviewed', 'yearly', 'Diploma in Forestry', 'Agroforestry Agent 7Forks', '3.7', '3', NULL, '4', '01/01/2021 - 12/31/2021', 'The staff has good attitude for the job,good team work and drive for results. He can go higher in his career with guidance and trainings.', '2021-11-02 13:21:12', '2021-11-11 07:04:18'),
(8, 78, 'HOD reviewed', 'yearly', 'KCPE', 'Head of Nursery Nyongoro', '9.7', '121', NULL, '4', '11/03/2021 - 11/03/2021', 'Evaluation is very good, however office should help us in the achievement of our set objectives by providing all relevant requirements at the correct time.eg; Delivery of seeds and chemicals.', '2021-11-03 11:46:26', '2021-11-11 07:09:05'),
(10, 5, 'HOD reviewed', 'yearly', 'Diploma', 'Farmer Group Formation and Coordinating Officer', '6', '3', NULL, '4', '01/01/2021 - 03/01/2021', 'Good attitude  and self motivation performed  well on his job.', '2021-11-04 08:04:41', '2021-11-20 04:26:13'),
(11, 135, 'HOD reviewed', 'yearly', 'Kenya certificate secondary education', 'Plantation Maintenance Staff Nyongoro', '4.5', '93', NULL, '4', '12/31/2020 - 12/31/2021', '82', '2021-11-06 05:17:38', '2021-11-11 07:35:29'),
(12, 115, 'HOD reviewed', 'yearly', 'Accountant technician diploma-level 1', 'Plantation Maintenance Staff Nyongoro', '3', '93', NULL, '4', '12/31/2020 - 12/31/2021', '80', '2021-11-06 08:30:50', '2021-11-11 07:21:38'),
(13, 91, 'HOD reviewed', 'yearly', 'Kenya certificate secondary education', 'Plantation Maintenance Staff Nyongoro', '5', '93', NULL, '4', '01/01/2021 - 12/31/2021', 'The staff is a self driven and result oriented employee. he showed positive attitude and undertook his duties perfectly to detail.', '2021-11-08 06:18:19', '2021-11-11 12:31:36'),
(14, 3, 'HOD reviewed', 'yearly', 'Certificate in Forestry', 'Site Manager Farmers Programme 7Forks', '6', '36', NULL, '4', '01/11/2021 - 01/11/2021', 'Determined individual with a great attitude', '2021-11-08 06:41:52', '2021-11-11 07:52:45'),
(15, 68, 'HOD reviewed', 'yearly', 'Bachelor of Science In Forestry', 'Forest Technician Kiambere', '0.9', '33', NULL, '4', '02/15/2021 - 11/08/2021', 'Last Appraisal was probation assessment in August 2021', '2021-11-08 08:42:13', '2021-11-11 12:18:45'),
(16, 117, 'HOD reviewed', 'yearly', 'Diploma', 'Site Mechanic Nyongoro', '2.9', '123', NULL, '8', '11/08/2021 - 11/08/2021', '78', '2021-11-08 09:21:08', '2021-11-30 13:41:40'),
(17, 83, 'HOD reviewed', 'yearly', 'Kenya certificate primary education', 'Plantation Maintenance Staff Nyongoro', '5', '93', NULL, '4', '01/01/2021 - 12/31/2021', 'The staff showed high level of professionalism and expertise on forestry related task. he is result oriented, dynamic, detailed and with positive attitude towards roles assigned.', '2021-11-08 09:25:49', '2021-11-11 12:23:34'),
(18, 113, 'HOD reviewed', 'yearly', 'KCSE', 'Plantation Maintenance Staff Nyongoro', '3.3', '93', NULL, '4', '11/08/2021 - 11/08/2021', 'Performed immensely good', '2021-11-08 09:57:04', '2021-11-11 13:13:03'),
(19, 6, 'HOD reviewed', 'yearly', 'Diploma in Agriculture and Biotechnology', 'Farmer Groups Formation and Coordination Officer (', '5', '36', NULL, '4', '01/01/2021 - 01/11/2021', '-have stride in ensuring all farmers are in active groups\r\n-Able to manage and lead the team to ensure groups become main vocal points of our interaction with farmers.\r\n-Able to form a strategy of actively using groups to bolster our tree survival.', '2021-11-08 10:13:32', '2021-11-11 07:59:27'),
(20, 13, 'HOD reviewed', 'yearly', 'DIPLOMA IN FORESTRY', 'Farmer Group Formation and Coordinating Officer', '3', '3', NULL, '4', '01/01/2021 - 01/11/2021', 'THE STAFF HAS GOOD ATTITUDE FOR THE JOB AND HIGH SELF MOTIVATION\r\nTHE STAFF NEEDS TO WORK ON MISSED TARGETS MAINLY ON TREE MONITORING', '2021-11-08 10:32:26', '2021-11-11 08:21:51'),
(22, 10, 'HOD reviewed', 'yearly', 'diploma', 'Agroforestry Agent 7Forks', '3.9', '3', NULL, '4', '11/08/2021 - 11/08/2021', 'The staff has a good attitude for the job though he needs to work to improve on communication planning and organizing he needs also to and organizing he needs also to work towards areas where targets were not achieved', '2021-11-08 11:03:58', '2021-11-11 08:16:03'),
(23, 15, 'HOD reviewed', 'yearly', 'Bsc. in Environmental  Science,  Diploma in Forestry,  Certificate in Forestry', 'Agroforestry Agent 7Forks', '3', '3', NULL, '4', '11/08/2021 - 11/08/2021', 'The staff needs to improve on communication and attitude towards his jobs. This can be achieved through commitment,  monitoring and guidance by the supervisor.', '2021-11-08 11:10:45', '2021-11-11 08:28:26'),
(24, 122, 'HOD reviewed', 'yearly', 'BSc. Forestry', 'Monitoring & Evaluation Officer', '2', '31', NULL, '8', '05/07/2021 - 11/08/2021', 'The passion and determination for the Job is exemplary.', '2021-11-08 15:07:35', '2021-11-24 10:59:52'),
(25, 8, 'HOD reviewed', 'yearly', 'MBA in Business Administration, CPAK', 'Director of Finance and Operations', '10', '130', NULL, '137', '01/11/2020 - 03/10/2021', 'POSITIVE', '2021-11-09 06:40:35', '2021-11-11 08:54:16'),
(26, 98, 'HOD reviewed', 'yearly', 'KCSE', 'Plantation Maintenance Staff Nyongoro', '4.6', '93', NULL, '4', '01/01/2021 - 12/30/2021', 'Bakari is hardworking, discipline, and committed staff.', '2021-11-09 06:44:14', '2021-11-12 02:49:54'),
(27, 26, 'HOD reviewed', 'yearly', 'Diploma in Agriculture', 'Farmers Group Formation and Coordinator Officer', '2', '36', NULL, '4', '01/01/2021 - 11/09/2021', 'Good, but there need for improvements in some areas especially Time management, Communication', '2021-11-09 06:46:57', '2021-11-11 10:05:09'),
(28, 58, 'HOD reviewed', 'yearly', 'None', 'Plantation Maintenance Staff Kiambere', '7', '68', NULL, '4', '03/10/2015 - 03/10/2015', 'For the past 9 Months, the employee has been respectful and dedicated to his work. He is trained in all the maintenance activities and always willing to be assigned any task.', '2021-11-09 07:10:10', '2021-11-11 13:16:32'),
(29, 99, 'HOD reviewed', 'yearly', 'Kenya certificate secondary education', 'Plantation Maintenance Staff Nyongoro', '4.5', '93', NULL, '4', '01/01/2021 - 12/31/2021', 'Salim has positive attitude towrads work, his overall performance at work is excellent. He is discipline,result oriented and a dynamic employee.', '2021-11-09 07:17:55', '2021-11-12 02:45:20'),
(30, 28, 'HOD reviewed', 'yearly', 'Bachelors degree in Procurement and Logistics Management', 'Site Logistic Manager', '1.11', '38', NULL, '8', '11/09/2020 - 11/09/2021', 'OM to follow up with FOD as the appraisal was not shared back', '2021-11-09 07:36:34', '2021-11-30 13:43:40'),
(31, 106, 'HOD reviewed', 'yearly', 'KCSE', 'Head of Security  Nyongoro', '5', '123', NULL, '8', '11/09/2021 - 11/09/2021', '44', '2021-11-09 07:42:34', '2021-11-30 13:57:40'),
(32, 64, 'HOD reviewed', 'yearly', 'Form Four Level', 'Plantation Maintenance Staff Kiambere', '4', '68', NULL, '4', '03/20/2021 - 11/09/2021', 'The employee had improved in doing most of his work, however improvement was needed in terms management and punctuality.', '2021-11-09 11:30:38', '2021-11-11 13:20:04'),
(33, 35, 'HOD reviewed', 'yearly', 'Diploma In Purchasing and Supplies', 'Procurement Officer', '3.01', '38', NULL, '8', '11/04/2020 - 11/09/2021', 'OM to follow with FOD because the scores were not shared with team', '2021-11-09 11:38:24', '2021-11-30 13:45:48'),
(34, 120, 'HOD reviewed', 'yearly', 'Class 7', 'Security Guard Nyongoro', '5', '123', NULL, '8', '01/01/2021 - 11/09/2021', '39', '2021-11-09 11:53:28', '2021-11-30 13:58:09'),
(35, 18, 'HOD reviewed', 'yearly', 'bachelor of microfinance', 'Farmers R/ship&Ditrbtn o', '2', '36', NULL, '4', '01/01/2021 - 11/09/2021', 'the employee has the right attitude towards the job given that it was the first time to manage the over-all process of distribution but she did agood job and monitoring , follow ups were to be made in time to ensure good exercise accomplished.\r\nT he employee has promised to improve on communication, teamwork, planning and organising to which the job need most', '2021-11-09 12:02:18', '2021-11-11 09:56:32'),
(36, 94, 'HOD reviewed', 'yearly', 'KCSE', 'Plantation Maintenance Staff Nyongoro', '4.8', '93', NULL, '4', '01/01/2021 - 12/31/2021', 'None', '2021-11-09 12:56:01', '2021-11-11 13:35:41'),
(37, 95, 'HOD reviewed', 'yearly', 'Kenya certificate primary education', 'Plantation Maintenance Staff Nyongoro', '4.5', '93', NULL, '4', '01/01/2021 - 12/31/2021', 'Improved attitude, previously required close supervision. However, self drive to work was noted and the staff is ready to learn.', '2021-11-09 12:58:17', '2021-11-11 13:45:26'),
(38, 11, 'HOD reviewed', 'yearly', 'Diploma  in Forestry', 'Agroforestry Agent 7Forks', '3', '3', NULL, '4', '01/01/2021 - 01/11/2021', 'I have greatly changed in attitude .\r\nGoing forward through  trainings and self discipline more will be realised .', '2021-11-09 13:10:50', '2021-11-11 08:32:51'),
(39, 127, 'HOD reviewed', 'yearly', 'BSC. Natural Resources Management', 'Monitoring & Evaluation Officer  GIC', '4.0', '3', NULL, '4', '01/01/2021 - 01/11/2021', 'The staff has good attitude for the job, though communication and punctuality need improvement', '2021-11-09 15:10:12', '2021-11-11 08:49:07'),
(40, 126, 'HOD reviewed', 'yearly', 'Bsc. Natural Resources Management', 'Montoring & Evaluation Officer GIC', '4.25', '3', NULL, '4', '01/01/2021 - 01/01/2021', 'The staff has performed well on KPls. He need to improve about on communication and punctuality', '2021-11-09 15:12:19', '2021-11-11 08:43:16'),
(41, 128, 'HOD reviewed', 'yearly', 'BSC. Environmental Sciences', 'Monitoring & Evaluation officer GIC', '3.75', '3', NULL, '4', '11/09/2021 - 11/09/2021', 'The staff has performed well he need to improve a lot on punctuality and communication through guidance and monitoring.', '2021-11-09 15:14:54', '2021-11-11 08:51:28'),
(42, 17, 'HOD reviewed', 'yearly', 'Bsc in Forestry.\r\nCertificate in Monitoring and Evaluation.', 'Monitoring & Evaluation Officer', '1.8', '31', NULL, '8', '11/05/2021 - 11/09/2021', 'Fredrick has shown determination to achieve results by ensuring conformity to all standards. He has a strict moral conduct and has managed well the relationship with site staff. \r\n2021 objectives are to improve the 7 forks program through working with groups. It is the role of Fredrick to ensure that this is done correctly and is effective in its purpose.\r\nThe areas of improvement required are:\r\n The grasp of all the standards and procedures. This shall be achieved through a series of trainings and thorough reading of all the approved reference documents.\r\nA training on the disciplines of writing a proper checklist. To ensure that nothing is left unchecked.', '2021-11-09 15:23:34', '2021-11-24 11:38:37'),
(43, 54, 'HOD reviewed', 'yearly', 'Primary Level', 'Plantation Maintenance Staff Kiambere', '5', '68', NULL, '4', '03/01/2021 - 11/10/2021', 'The employee has shown commitment towards his work and improvement in giving correct figures for the past nine months I have interacted with him.', '2021-11-10 04:44:19', '2021-11-12 03:03:35'),
(44, 25, 'HOD reviewed', 'yearly', 'MSc Agroforestry', 'Site Farmers programme Manager', '3', '36', NULL, '4', '01/01/2021 - 11/10/2021', 'Improvement in teamwork, managing relationships and reliability. Focused and with continued training and monitoring will be an asset. Key areas to improve on are communication, planning and organising.', '2021-11-10 04:54:24', '2021-11-11 11:33:33'),
(45, 22, 'HOD reviewed', 'yearly', 'Senior four', 'Security', '3.4', '28', NULL, '8', '11/24/2020 - 11/10/2021', '47/50, good', '2021-11-10 05:45:38', '2021-11-30 13:59:51'),
(46, 112, 'HOD reviewed', 'yearly', 'Diploma in electrical engineering (power option)', 'Plantation Maintenance Staff Nyongoro', '3', '93', NULL, '4', '01/01/2021 - 12/31/2021', 'The staff showed excellent attitude toward work with wonderful ethics of core values, expertise and professionalism when handling task assigned. He is discipline, dynamic, result oriented and has good sense of self drive.', '2021-11-10 06:01:59', '2021-11-12 02:41:59'),
(47, 108, 'HOD reviewed', 'yearly', 'KCSE', 'Plantation Maintenance Staff Nyongoro', '3.6', '93', NULL, '4', '01/01/2021 - 12/31/2021', 'He is a good performer, self drive for achieving results, an individual with a likable character especially with workers and when managing people.', '2021-11-10 06:10:45', '2021-11-12 05:51:24'),
(48, 7, 'HOD reviewed', 'yearly', 'Diploma in forestry', 'Agroforestry Agent 7Forks', '4.5', '3', NULL, '4', '01/01/2021 - 01/11/2021', 'Good work though there is need to improve in weak areas where l did not achieve.', '2021-11-10 06:11:28', '2021-11-11 09:17:32'),
(49, 55, 'HOD reviewed', 'yearly', 'Form Four Level', 'Plantation Maintenance Staff Kiambere', '5', '68', NULL, '4', '03/01/2021 - 11/10/2021', 'The employee has shown commitment towards his work and improvement in giving correct figures for the past nine months I have interacted with him.', '2021-11-10 06:35:34', '2021-11-12 03:07:10'),
(50, 32, 'HOD reviewed', 'yearly', 'Degree in Hospitality', 'Communication Manager', '3', '130', NULL, '137', '01/11/2020 - 03/10/2021', '2020', '2021-11-10 07:35:07', '2021-11-10 14:46:53'),
(51, 9, 'HOD reviewed', 'yearly', 'Diploma in Forestry', 'Monitoring and Evaluation Officer', '4.5', '31', NULL, '8', '11/10/2020 - 11/10/2021', 'She has shown dedication to her work through group trainings which is key to farmer program. The staff though needs to speed up the farmer group formation', '2021-11-10 07:51:28', '2021-11-24 11:24:36'),
(52, 62, 'HOD reviewed', 'yearly', 'Primary Level', 'Plantation Maintenance Staff Kiambere', '5', '68', NULL, '4', '03/12/0021 - 11/10/2021', 'The employee has shown commitment towards his work and improvement in giving correct figures for the past nine months I have interacted with him.', '2021-11-10 07:58:22', '2021-11-12 03:28:16'),
(53, 20, 'HOD reviewed', 'yearly', 'Diploma in Agroforestry', 'Agroforestry Agent', '3', '25', NULL, '4', '01/01/2021 - 10/11/2021', 'The employee will be of good value to the company in time to come since he is a good performer', '2021-11-10 08:14:15', '2021-11-11 10:10:29'),
(54, 27, 'HOD reviewed', 'yearly', 'Diploma in crop production and management', 'Agroforestry Agent', '2', '25', NULL, '4', '01/01/2021 - 10/11/2021', 'A team player with proven urge to drive for results, promise to improve area of weaknesses and the company is yet to benefit from him.', '2021-11-10 08:17:21', '2021-11-11 11:18:02'),
(55, 23, 'HOD reviewed', 'yearly', 'Chief instructor security', 'Security', '3.10', '28', NULL, '8', '11/24/2020 - 11/24/2021', '47/55', '2021-11-10 08:19:00', '2021-11-30 14:01:00'),
(56, 21, 'HOD reviewed', 'yearly', 'Diploma in crop production', 'Agroforestry Agent', '3', '25', NULL, '4', '01/01/2021 - 11/10/2021', 'The employee has a strong  will to do the job he needs  to improve alot in planing,  organization  and farmers knowledge .He needs to empower the CR and actively  form groups  which will  help in providing  most of the information', '2021-11-10 08:24:26', '2021-11-11 11:13:19'),
(57, 44, 'HOD reviewed', 'yearly', 'Form Four', 'Plantation Maintenance', '6', '68', NULL, '4', '03/01/2015 - 11/10/2021', 'The employee has shown commitment towards his work and improvement in giving correct figures for the past nine months I have interacted with him.', '2021-11-10 09:08:51', '2021-11-12 02:59:03'),
(58, 19, 'HOD reviewed', 'yearly', 'Diploma in forestry', 'Agroforestry Agent', '3', '25', NULL, '4', '01/01/2021 - 10/11/2021', 'The employee has improved a lot in terms of confidence and expressing herself. She is focused and she is coachable , but she needs to work a lot towards correct data for farmers , farmers monitoring and follow ups which can be effectively achieved through having active groups and trustworthy CRs', '2021-11-10 09:51:47', '2021-11-11 09:37:35'),
(59, 66, 'HOD reviewed', 'yearly', 'Form Four', 'Plantation Maintenance Staff Kiambere', '5', '68', NULL, '4', '03/02/2017 - 11/10/2021', 'The employee was useful in assisting in the establishment of seedling for research and has been useful in reporting of occurrence from the plantation', '2021-11-10 10:30:40', '2021-11-12 03:38:33'),
(60, 2, 'HOD reviewed', 'yearly', 'Ongoing BBA With IT', 'Information & Administration Officer', '1.99', '137', NULL, '137', '11/10/2021 - 11/10/2021', 'Improved attitude of all workers in regard to the system, this is a great sign that the organization has\r\nimproved in service delivery in regards to ICT, However , still more emphasis to be directed on\r\ncontinuous trainings of the System/Applications that we are using.', '2021-11-10 10:46:07', '2021-11-12 08:54:58'),
(61, 110, 'HOD reviewed', 'yearly', 'KCSE', 'Plantation Maintenance Staff Nyongoro', '3.7', '93', NULL, '4', '01/01/2021 - 12/31/2021', 'His ability to listen, paying attention to details and taking instruction as given creates an environment where workers feel respected and empowered to help each others perform and deliver efficiently.', '2021-11-10 11:13:27', '2021-11-12 05:56:08'),
(62, 16, 'HOD reviewed', 'yearly', 'KCPE', 'Farmer Group Formation and Coordinating Officer', '13', '3', NULL, '4', '01/11/2021 - 01/11/2021', 'A dedicated employee especially in nursery production', '2021-11-10 11:33:49', '2021-11-11 09:29:03'),
(63, 1, 'HOD reviewed', 'yearly', 'BSc Mathematics and computer science', 'Information Security Officer', '2', '137', NULL, '137', '11/01/2020 - 11/01/2021', 'There has been a great improvement and growth in the employee', '2021-11-10 11:34:31', '2021-11-12 13:13:15'),
(64, 65, 'HOD reviewed', 'yearly', 'Primary Level', 'Plantation Maintenance Staff Kiambere', '5', '68', NULL, '4', '03/01/2017 - 11/10/2021', 'The employee has shown commitment towards his work and improvement in giving correct figures for the past nine months I have interacted with him.', '2021-11-10 11:38:50', '2021-11-12 03:34:51'),
(65, 24, 'HOD reviewed', 'yearly', 'Crime preventer/Uganda Police', 'Security', '3.11', '28', NULL, '8', '02/10/2020 - 11/10/2021', '49/55', '2021-11-10 12:24:20', '2021-11-30 14:01:46'),
(66, 121, 'HOD reviewed', 'yearly', 'BSc. FORESTRY', 'Site Manager Nursery Nyongoro', '1.8', '33', NULL, '4', '01/01/2021 - 11/10/2021', '1. EMPLOYEE’S COMMENTS: \r\nThanks to my supervisor who have been guiding and advising me on all pertaining quality seedling production. \r\nAppreciation to my department and the entire organization for standing firm with employees including me during this hard time of covid-19. \r\n\r\n2. SUPERVISOR’S COMMENTS:\r\nThe employee has adjusted well to his workstation and has shown willingness to learn and good attitude. However more training is required for him to improve on germination percentage and reduce mortality in the nursery. Importance of communication has been emphasized and tremendous improvement is expected.\r\n\r\n3. HOD COMMENTS:\r\nThere was improved germination %, cleaner nursery and management of nursery stock. However, there still needs to be improvement in communication with the staff he supervises.', '2021-11-10 12:46:14', '2021-11-11 12:05:24'),
(67, 56, 'HOD reviewed', 'yearly', 'Primary Level', 'Plantation Maintenance Staff Kiambere', '5', '68', NULL, '4', '03/01/2017 - 11/10/2021', 'The employee has shown commitment towards his work and improvement in giving correct figures for the past nine months I have interacted with him.', '2021-11-10 12:55:05', '2021-11-12 03:16:10'),
(68, 29, 'HOD reviewed', 'yearly', 'diploma agroforestry', 'Forest Technician Nursery', '1.11', '25', NULL, '4', '01/01/2021 - 10/11/2021', 'The employee is improvable. Being his first time as a Forest technician nursery, he has done average and this can be improved through constant monitoring and trainings by the immediate supervisor', '2021-11-10 12:56:19', '2021-11-11 11:20:51'),
(69, 63, 'HOD reviewed', 'yearly', 'Primary Level', 'Plantation Maintenance Staff Kiambere', '5', '68', NULL, '4', '03/01/2017 - 11/10/2021', 'The employee has shown commitment towards his work and improvement in giving correct figures for the past nine months I have interacted with him.', '2021-11-10 13:39:06', '2021-11-12 03:31:08'),
(70, 92, 'HOD reviewed', 'yearly', 'Kenya certificate primary education', 'Plantation Maintenance Staff Nyongoro', '5', '93', NULL, '4', '01/01/2021 - 12/31/2021', 'His ability to listen, paying attention to details and taking instruction as given creates an environment where workers feel respected and empowered to help each others perform and deliver efficiently.', '2021-11-10 13:50:49', '2021-11-12 03:42:10'),
(71, 60, 'HOD reviewed', 'yearly', 'Primary Level', 'Plantation Maintenance Staff Kiambere', '10', '68', NULL, '4', '01/03/2011 - 11/10/2021', 'The employee has shown commitment towards his work and improvement in giving correct figures for the past nine months I have interacted', '2021-11-10 14:16:46', '2021-11-12 03:23:13'),
(72, 59, 'HOD reviewed', 'yearly', 'Primary Level', 'Plantation Maintenance Staff Kiambere', '6', '68', NULL, '4', '02/19/2016 - 11/10/2021', 'The employee has shown commitment towards his work and improvement in giving correct figures for the past nine months I have interacted with him.', '2021-11-10 14:52:18', '2021-11-12 03:20:09'),
(73, 38, 'HOD reviewed', 'yearly', 'Bachelors degree in Business Management', 'Operations Manager', '0.73', '8', NULL, '8', '11/10/2021 - 11/10/2021', 'g', '2021-11-10 17:07:38', '2021-11-18 10:04:57'),
(74, 111, 'HOD reviewed', 'yearly', 'Kenya certificate secondary education', 'Plantation Maintenance Staff Nyongoro', '3', '93', NULL, '4', '01/01/2021 - 12/31/2021', 'Ali should improve on self drive in order to achieve desired targets. Mores so he requires to be more assertive in managing workers, he is honest and a good team player. He should improve on his time and attendance records.', '2021-11-11 06:09:01', '2021-11-11 12:29:58'),
(75, 57, 'HOD reviewed', 'yearly', 'Primary Level', 'Plantation Maintenance Staff Kiambere', '9', '68', NULL, '4', '01/15/2013 - 11/11/2021', 'The employee has shown commitment towards his work and improvement in giving correct figures for the past nine months I have interacted with him.', '2021-11-11 06:31:06', '2021-11-11 16:59:47'),
(76, 119, 'HOD reviewed', 'yearly', 'Bsc in Forestry', 'Site Manager Plantation Nyongoro', '2.5', '33', NULL, '4', '01/01/2021 - 11/11/2021', 'EMPLOYEE’S COMMENTS:\r\nWorkers grievances were adequately addressed throughout 2020 by the management.\r\nIn general workers are happy working with better globe forestry due to better presentation and addressing of their needs by the management.\r\n\r\nSUPERVISOR’S COMMENTS:\r\nMeeting the planting targets is important but also making sure the trees survive to maturity is crucial.\r\nGoing into 2021, one of the objectives is to eliminate mortality. The team should ensure we don’t loose any tree in the field considering the resources spent to plant including monetary and time.\r\n\r\n\r\nHOD COMMENTS:\r\nStephen has shown a great attitude towards ensuring that the results expected of him are achieved. The year started well in the first four months exceeding set targets. However, high mortality was experienced either because of inadequate information about the plantation. Therefore, he must better manage the staff he supervises to get timely and correct information to guide in decision making.', '2021-11-11 08:18:36', '2021-11-11 11:59:47'),
(78, 123, 'HOD reviewed', 'yearly', 'BSc. Water Resource Management', 'Site logistics Officer', '1.9', '38', NULL, '8', '04/24/2021 - 11/11/2021', '59/75', '2021-11-11 09:07:35', '2021-11-30 13:47:13'),
(79, 37, 'HOD reviewed', 'yearly', 'Bachelor of Economics and Finance\r\nCPA K', 'Accounts Manager', '2', '8', NULL, '8', '01/11/2020 - 03/11/2021', 'Have a grip on accounts\r\nCan do better', '2021-11-11 11:23:39', '2021-11-11 14:28:03'),
(80, 33, 'HOD reviewed', 'yearly', 'Bsc Agroforestry and Rural Development.', 'Plantation Manager', '3', '4', NULL, '4', '01/01/2021 - 11/11/2021', 'EMPLOYEE’S COMMENTS:\r\nI have learned on the importance of effective communication, follow up and doing things right the first time which all contribute to target achievement and saving costs.\r\nMeeting planting targets is important and having the trees survive is extremely important.\r\nCorrect information is important for decision making.\r\n\r\nSUPERVISOR’S COMMENTS:\r\nHe has gained more technical skills over the year as he had to step in and be responsible for site activities in the absence of site managers. He should however focus more on training the people he supervises and giving them capacity to perform even when he is not present at sites.', '2021-11-11 11:48:22', '2021-11-12 07:43:09'),
(81, 36, 'HOD reviewed', 'yearly', 'BSc. Forestry', 'Farmers programme Manager', '3', '4', NULL, '4', '01/01/2021 - 11/11/2021', 'There has been great improvement in his understanding of the farmers program in spite of the Challenges posed this year by COVID and limited contact with field staff. \r\n\r\nIt is also critical to note that we still have a high mortality with farmers in spite of all the improvements put in place. Therefore, he must put his best foot forward and ensure that mortality with farmers is eliminated.', '2021-11-11 12:59:25', '2021-11-12 09:00:25'),
(82, 77, 'HOD reviewed', 'yearly', 'Class 7', 'Head Heavy Equipment', '9', '123', NULL, '8', '11/12/2021 - 11/12/2021', 'Employee Had A Different Supervisor Then.', '2021-11-12 08:55:20', '2021-11-30 13:48:51'),
(83, 4, 'HOD reviewed', 'yearly', 'Bsc, Forestry', 'Deputy Director Forestry', '9.06', '130', NULL, '137', '01/01/2021 - 11/12/2021', '2020 indeed was a challenging year in various aspects. Covid-19 is one of them, incorrect information is another. Regarding Covid-19, this relates to the performance of Samuel’s 2 assistants, the one in charge of farmer programmes, and the one in charge of plantations. Both needed to get managerial responsibilities, and this has been achieved to a large extent. The former must get more knowledge on what is going on in the field, and therefore he must be there more time there than was possible last year. The latter knows the field better as he spent more time there, and Samuel has been pushing him to be stricter with his people and I think that is starting to work, although late. Regarding incorrect information, this is linked to (i) routine follows-up of activities and (ii) the M&E. The routine follow-up is being digitized in waterproof systems, and the M&E should have been giving more attention to tree counting in Nyongoro, although it is easy to say with hindsight.', '2021-11-12 09:21:24', '2021-11-12 12:02:32'),
(84, 105, 'HOD reviewed', 'yearly', 'Form IV', 'Tractor Driver Nyongoro', '5', '123', NULL, '8', '10/13/2020 - 11/13/2021', '65/80', '2021-11-13 06:46:11', '2021-11-30 13:50:18'),
(85, 124, 'HOD reviewed', 'yearly', 'Class 7', 'Tractor Driver', '1.2', '123', NULL, '8', '10/13/2020 - 11/13/2021', '65/85', '2021-11-13 16:09:51', '2021-11-30 13:51:38'),
(86, 90, 'HOD reviewed', 'yearly', 'Class 8', 'Tractor Driver Nyongoro', '5.5', '38', NULL, '8', '10/15/2020 - 10/15/2021', 'OM to confirm the score with FOD because it was not shared.', '2021-11-15 07:44:47', '2021-11-30 13:53:10'),
(87, 125, 'HOD reviewed', 'yearly', 'Class 6', 'Tractor Driver', '1.2', '123', NULL, '8', '02/15/2021 - 11/15/2021', '62/85', '2021-11-15 10:00:14', '2021-11-30 13:54:26'),
(88, 118, 'HOD reviewed', 'yearly', 'Class 2', 'Tractor Driver Nyongoro', '2.8', '123', NULL, '8', '10/16/2020 - 11/16/2021', '63/85', '2021-11-16 05:51:10', '2021-11-30 13:56:45'),
(89, 116, 'HOD reviewed', 'yearly', 'Automotive Mechanic (Grade II)', 'Tractor Driver / Mechanic Nyongoro', '3.7', '123', NULL, '8', '11/16/2020 - 11/16/2021', 'Employee Evaluated by the Late Herman. Overall Assessment not known.', '2021-11-16 08:24:32', '2021-11-30 13:55:58'),
(90, 31, 'HOD reviewed', 'yearly', 'Bsc. Agroforestry and Rural Development', 'Monitoring & Evaluation Manager', '4.5', '8', NULL, '8', '11/25/2021 - 11/25/2021', 'The work done was improvable.', '2021-11-17 08:25:12', '2021-11-19 08:25:32'),
(91, 41, 'HOD reviewed', 'yearly', 'Bachelor of Business Administration', 'Assistant Accountant', '2.5', '37', NULL, '8', '11/01/2020 - 10/31/2021', 'You can do better, continue seeking and embracing better ways of increasing your effectiveness in accounting and reporting.', '2021-11-17 11:39:07', '2021-11-17 13:48:56'),
(92, 30, 'HOD reviewed', 'yearly', 'CPA', 'Accountant Head Office', '9', '37', NULL, '8', '11/18/2020 - 11/18/2021', 'CAN DO BETTER, NEEED TO CONCENTRATE MORE ON THE SET OBJECTIVES', '2021-11-18 11:32:43', '2021-11-18 13:22:05'),
(93, 34, 'HOD reviewed', 'yearly', 'BCOM-Finance, CPAK', 'Human resource manager', '3.5', '130', NULL, '137', '11/01/2020 - 10/30/2021', 'We are fully satisfied with Lydia\'s performance. She is well integrated in the Management\r\nteam and respected by the staff. She was the best choice for the job and has she definately \r\nhas room to grow. Well done!', '2021-11-18 11:45:54', '2021-11-18 14:04:00'),
(94, 129, 'HOD reviewed', 'yearly', 'Class 8', 'Staff Welfare Head Office', '10', '34', NULL, '34', '11/01/2020 - 10/30/2021', 'Improve on the attitude and work as team especially with procurement department', '2021-11-26 11:37:47', '2021-12-01 10:53:17'),
(97, 139, 'HOD reviewed', 'yearly', 'BSC. Forestry', 'Intern', '0.25', '4', NULL, '4', '10/06/2021 - 10/06/2021', 'None', '2022-01-06 11:44:59', '2022-01-06 13:40:02'),
(98, 138, 'HOD reviewed', 'yearly', 'Bsc Forestry', 'Intern', '0.25', '4', NULL, '4', '10/06/2021 - 12/31/2021', 'None', '2022-01-06 11:45:43', '2022-01-06 13:11:29'),
(100, 140, 'HOD reviewed', 'yearly', 'Certificates in tropical Agriculture(Stage 1 and stage 2)', 'Monitoring &evaluation officer', '.25', '31', NULL, '8', '01/17/2022 - 04/21/2022', 'Nil', '2022-04-27 11:24:58', '2022-05-03 10:30:12'),
(101, 141, 'HOD reviewed', 'probation', 'Bsc Forestry', 'FSC officer', '0.4', '4', NULL, '4', '02/02/2022 - 02/05/2022', 'GOOD', '2022-06-10 16:28:49', '2022-06-10 17:36:09'),
(102, 142, 'HOD reviewed', 'probation', 'Kenya Certificate of Secondary Education', 'Mrs', '0.3', '74', NULL, '8', '08/03/2022 - 08/03/2022', 'N/A', '2022-08-03 10:44:46', '2022-08-17 14:07:18'),
(103, 143, 'HOD reviewed', 'probation', 'Worked in BGF as a casual', 'Mr', '0.3', '74', NULL, '8', '03/15/2022 - 08/03/2022', 'N/A', '2022-08-03 12:10:39', '2022-08-17 14:05:16'),
(104, 144, 'HOD reviewed', 'probation', 'Bachelor of Environmental Science', 'Editor', '0.4', '131', NULL, '145', '04/26/2022 - 07/31/2022', 'N/A', '2022-08-10 11:12:46', '2022-08-11 18:16:13'),
(106, 146, 'HOD reviewed', 'probation', 'Completed Kenya Certificate of Secondary Education in 2012', 'Mr', '0.6', '74', NULL, '8', '02/02/2022 - 08/17/2022', 'From the last assessment on the first three months, the employee was required to improve on communication with his supervisors and to ensure they both work as a team.', '2022-08-17 07:47:31', '2022-08-17 13:56:07'),
(107, 147, 'HOD reviewed', 'probation', 'Form IV', 'Assistant Head of Security', '0.5', '148', NULL, '8', '01/19/2022 - 08/19/2022', '39/70', '2022-08-19 09:50:30', '2022-08-19 16:12:20'),
(109, 148, 'HOD reviewed', 'probation', 'FORM IV', 'HEAD OF SECURITY', '0.5', '123', NULL, '8', '02/15/2022 - 07/15/2022', '34/70', '2022-08-19 13:36:24', '2022-08-19 16:11:48'),
(110, 17, 'HOD reviewed', 'probation', 'Bsc. Forestry,certificate in Monitoring and Evaluation', 'Monitoring & Evaluation Officer', '2.5', '8', NULL, '8', '06/13/2022 - 08/31/2022', 'The overall performance of Fredrick is good judging from his short period at Kiambere site where he brought numerous improvements and clean up of the site, and now his tenure in 7 forks is proving fruitful as the endless reports can now be verified.', '2022-09-01 10:07:45', '2022-09-07 14:23:54'),
(111, 37, 'HOD reviewed', 'yearly', 'Bachelor of Economics and Finance, CPA K', 'Accounts Manager', '3', '8', NULL, '8', '11/01/2021 - 11/30/2022', 'Have a grip on accounts Can do better', '2022-11-07 14:38:34', '2022-11-08 19:02:10'),
(112, 73, 'HOD reviewed', 'yearly', 'Kenya certificate of secondary education', 'Security Guard', '0.1', '70', 38, '8', '11/07/2022 - 11/07/2022', 'Null', '2022-11-07 14:57:35', '2022-11-15 18:32:54'),
(113, 8, 'HOD reviewed', 'yearly', 'MBA - Strategic Management, BA Degree and CPAK', 'Director of Finance and Operations', '11', '130', NULL, '137', '11/01/2021 - 10/31/2022', 'We believe Lawrence is doing a great job as has been the case year after year. He is persistent and bites himself into a job until done. He has also grown in matters of managing people, not only in numbers but also in understanding the dynamics of managing. The last year was indeed challenging but Finance and operations in fact improved their workings. Today M&E is also under finance (it should have been straight from the beginning) and we already see results. All over we can say that in Lawrence we have a great leader.', '2022-11-07 15:52:36', '2022-11-22 15:19:24'),
(114, 36, 'HOD reviewed', 'yearly', 'BSc Forestry', 'Farmers programme Manager', '3.8', '4', NULL, '4', '11/07/2022 - 11/07/2022', '61/85', '2022-11-07 16:11:32', '2022-11-11 13:52:23'),
(115, 33, 'HOD reviewed', 'yearly', 'Bsc Agroforestry and Rural Development.', 'Plantation Manager', '4', '4', NULL, '4', '01/01/2022 - 11/11/2022', 'Employee: Comments\r\n\r\nThe year has been of corrections to ensure all aspects of the project/s go on well as planned going forward. A lot of training has been received all aligned to the company’s mission and vision and a lot of explanations and elaborations done e.g., why we need to always have the correct stock figures from the nursery to the plantation. The importance of communication and doing things right the first time has also been elaborated and insisted on the team.\r\n\r\nThis I can attest has had a positive effect to me and the team and we are ready to take on the coming year’s targets while maintaining and improving systems set in place to achieve the company’s objectives. \r\n\r\nSupervisor: Comments\r\n\r\nN/A\r\n\r\nHOD: Comments\r\n\r\nThere have been changes over the months in the objectives and the focus was on maintenance of the plantations, tree stock verification, and correction of all areas we have had challenges in. This required that plans are made for the maintenance activities, the teams being supervised are checked, guided accordingly, and made to understand the importance of the activities being carried out and how all these are aligned with the company\'s vision, mission, and short term objectives. Some of these activities were done well like stock verification in Kiambere, taking charge in the absence of a supervisor in Kiambere, improved pruning and cleaning by the teams involved. Some areas that had gaps but were addressed later in the year included the importance of tree counting and how all the activities we do are linked to the company\'s vision and mission. This however is something he must continuously address to his team. Other areas that need to be improved upon are as follows:\r\n\r\n1. Managing of plans:- It is not enough to make a plan but they must be constantly followed up and implemented. \r\n\r\n2. Being objective:- Focus should be on achieving the set objectives. Being nice or lenient to your team cannot help him in achieving the agreed-upon objectives. He should spend less time in back and forth explanations with his team that lead to delays in some instances and indecisiveness. Should focus on facts.\r\n\r\n3. He needs to work towards doing more within his capacity so that he can grow as a manager. He should not limit himself to simply just taking instructions, , relaying information or simply following up with issues. At his level, he should put more initiative in thinking or motivating his teams of solutions to improve his domain. \r\n\r\n4. Communication has also been an issue, however, this has been emphasized largely this year but should be something that he constantly addresses.\r\n\r\n5. Delegating of tasks should be improved because this is one of the ways he can help his team grow in capacity.', '2022-11-07 16:23:15', '2022-11-22 10:19:43'),
(116, 149, 'completed', 'yearly', 'Bachelor of Community forestry and Master of science in Environment and Natural resource management', 'Country Representative-UG', '10.8', '131', NULL, NULL, '11/07/2022 - 11/07/2022', 'last appraised in 2020: In this year of Covid-19 restrictions, Diana has responded well to on-line cooperation through Zoom meetings and other internet applications like Telegram. She has managed to maintain and expand slightly her subscription base and even got more articles, despite the circumstances.\r\nShe has however to continue to work on her editing skills including English language and be careful and not sloppy in her editing. But this has been taken care of in her training and development plan. Next year, she really has to do more field visits, to Dokolo, Kenya and South Africa, to upgrade her understanding of modern forestry. \r\nShe is instrumental in  maintaining a lively group of eminent forestry specialists in the Editorial Committee, and surely will increase her subscription database when the magazine goes digital. She made a good start with Rotary, as a basis for more visits next year, again with the objective of increasing the subscription base.', '2022-11-07 17:55:14', '2022-11-08 16:28:46'),
(117, 28, 'HOD reviewed', 'yearly', 'Bachelors Degree in Procurement and Logistics Management.', 'Site Logistic Manager', '3', '38', 38, '8', '11/08/2022 - 11/08/2022', 'An employee with a positive attitude who can do better. To work on the weak areas to keep up.', '2022-11-08 05:44:11', '2022-11-14 17:56:46'),
(118, 123, 'HOD reviewed', 'yearly', 'BSc. Water Resource Management', 'Site logistics Officer', '2.9', '38', 38, '8', '11/11/2021 - 11/08/2022', '66/85', '2022-11-08 10:28:18', '2022-11-14 18:53:28'),
(119, 141, 'HOD reviewed', 'yearly', 'BSc Forestry', 'FSC officer', '1', '4', NULL, '4', '02/02/2022 - 11/08/2022', 'GOOD', '2022-11-08 10:30:54', '2022-11-11 12:13:28'),
(120, 83, 'HOD reviewed', 'yearly', 'KCPE level', 'Plantation Maintenance Staff Nyongoro', '6', '119', NULL, '4', '01/01/2022 - 12/31/2022', 'Ronald Mukhwana is a hard worker always giving his best to any task he is assigned in the plantation. He has a great attitude towards his work. Like the rest of his colleagues, he needs to be made aware of how important the work he does is for the company. How it is linked to the mission and the vision.', '2022-11-08 11:56:24', '2022-11-10 11:23:37'),
(121, 78, 'HOD reviewed', 'yearly', 'KCPE', 'Head of Nursery Nyongoro', '11', '121', NULL, '4', '11/08/2021 - 11/08/2022', 'Employee: Comments\r\nEvaluation was interactive and good, it has showed me areas of improvement as well as those I need to maintain for achievement of company targets. \r\n\r\nSupervisor: Comments\r\nKarisa Johnson is a well informed, full of ideologies and very discipline. He has interesting interpersonal skills that made working with him enjoyable. \r\nHOD: Comments\r\nThere was no production this year and as expected not much for Sulubu to do in the nursery apart from cleanliness and maintenance of the nursery structures, identifying plus trees. This being said, he could have done more in terms of proposing some trials with the aim of improving the production process especially in the areas he has mentioned he needs on in section three.', '2022-11-08 12:13:16', '2022-11-10 13:08:09'),
(122, 29, 'HOD reviewed', 'yearly', 'Diploma agroforestry', 'Forest Technician Nursery', '3', '25', 4, '4', '01/01/2021 - 11/08/2022', 'The  employee is improbable. Being his first time as a Forest technician nursey, he had done  average and this can be improved through constant monitoring and training by the immediate supervisor', '2022-11-08 12:24:23', '2022-11-22 09:42:20'),
(123, 35, 'HOD reviewed', 'yearly', 'Diploma in purchasing and supplies', 'Procurement Officer', '3', '38', 38, '8', '11/08/2022 - 11/08/2022', 'The performance is average. Your job requires a lot of listening and following of instructions which your are weak. Work on your weak areas for improvement.', '2022-11-08 13:14:50', '2022-11-14 19:05:59'),
(124, 38, 'HOD reviewed', 'yearly', 'Bachelors degree in Business Management', 'Operations Manager', '1.8', '8', 38, '8', '11/10/2021 - 11/09/2022', '65.5/85', '2022-11-08 13:19:43', '2022-11-14 17:35:29'),
(125, 115, 'HOD reviewed', 'yearly', 'Accountant Technician diploma-Level 1', 'Plantation Maintenance Staff Nyongoro', '4', '119', NULL, '4', '01/01/2022 - 12/31/2022', 'Evaluation process was interractive and detailed, the staff understood the proposed corrections for better achievement of company objectives. Gideon is a discipline and workaholic staff.', '2022-11-08 13:40:58', '2022-11-10 13:16:27'),
(126, 10, 'HOD reviewed', 'yearly', 'Diploma in forestry', 'Agroforestry Agent 7Forks', '4.9', '6', 4, '4', '11/08/2022 - 11/08/2022', 'The staff has good attitude  for the job though he needs to work to improve  on communication planning and organizing ,he needs also to work towards areas where targets were not achieved.', '2022-11-08 14:01:23', '2022-11-12 19:23:41'),
(127, 17, 'HOD reviewed', 'yearly', 'B.Sc. in  Forestry, certificate in Monitoring and Evaluation', 'HO Monitoring & Evaluation Officer', '2.8', '8', 8, '8', '12/09/2021 - 12/11/2022', 'The overall performance of Fredrick is good judging from his short period at Kiambere site where he brought numerous improvements and clean up of the site, and now his tenure in 7 forks is proving fruitful as the endless reports can now be verified.', '2022-11-08 14:31:32', '2022-11-14 13:36:29'),
(128, 41, 'HOD reviewed', 'yearly', 'Bachelor of Business Adminstration', 'Assistant Accountant', '3.8', '37', 8, '8', '12/01/2021 - 11/30/2022', 'Maintaining team work and proper communication, continuous research is required to stay up to date with the requirements of my position.', '2022-11-08 14:38:47', '2022-11-14 13:42:21'),
(129, 135, 'HOD reviewed', 'yearly', 'KCSE', 'Plantation Maintainance Staff Nyongoro', '5', '119', NULL, '4', '01/01/2022 - 12/31/2022', 'Employee: Comments\r\n\r\n1. Evaluation process was smooth and clear on the objective of the company and personal growth. a single wish is to implement all suggestions as discussed.\r\n\r\nSupervisor: Comments\r\n\r\nThe evaluation was detailed an informative to serve the purpose of its intend on correcting and adjusting the needs of the staff in order to achieve the company vision and mission. The staff showed great sense of listening and positive critic during the discussion.\r\n\r\nHOD: Comments\r\n\r\nThere is little emphasis on his core tasks in forestry in terms of what he has been doing and intends to improve upon in the coming budget period. The transport issue is acknowledged and shall be addressed by the management in due time. salary increment is not automatic as continuously explained by the HR.', '2022-11-08 15:25:28', '2022-11-10 13:27:59'),
(130, 90, 'HOD reviewed', 'yearly', 'Class 8', 'Handyman', '6', '38', 38, '8', '10/15/2021 - 11/08/2022', '65.5/85', '2022-11-08 15:51:51', '2022-11-14 19:47:34'),
(131, 117, 'HOD reviewed', 'yearly', 'Diploma In  Mechanical Engineering.', 'Site Mechanic Nyongoro', '3.9', '123', 38, '8', '11/08/2021 - 11/08/2022', '72/85', '2022-11-08 16:10:19', '2022-11-14 19:37:03'),
(132, 121, 'HOD reviewed', 'yearly', 'BSc Forestry', 'Site Manager Nursery Nyongoro', '2', '36', NULL, '4', '11/08/2021 - 11/08/2022', 'EMPLOYEE’S COMMENTS: Thanks to my supervisor who have been guiding and advising me on all pertaining quality seedling production. Appreciation to my department and the entire organization for standing firm with employees including me during this hard time of covid-19.\r\nSUPERVISOR’S COMMENTS: The employee has adjusted well to his workstation and has shown willingness to learn and good attitude. However more training is required for him to improve on germination percentage and reduce mortality in the nursery. Importance of communication has been emphasized and tremendous improvement is expected.\r\nHOD COMMENTS: There was improved germination %, cleaner nursery and management of nursery stock. However, there still needs to be improvement in communication with the staff he supervises.', '2022-11-08 16:34:11', '2022-11-10 15:09:01'),
(133, 129, 'HOD reviewed', 'yearly', 'Class 8', 'Staff Welfare Head Office', '11', '34', 34, '137', '01/01/2022 - 10/31/2022', 'Her performance was generally good.', '2022-11-08 16:58:01', '2022-12-08 12:53:35'),
(134, 12, 'HOD reviewed', 'yearly', 'Diploma in Forestry', 'Agroforestry Agent 7Forks', '4.8', '6', 4, '4', '02/11/2021 - 02/11/2021', 'Antony has greatly improved on his attitude towards Bgf and the program. His team building skills and inquisitive nature has made him stand tall amongst his colleagues. Communication skills need to be improved.', '2022-11-08 17:03:31', '2022-11-12 19:24:20'),
(135, 99, 'HOD reviewed', 'yearly', 'KCSE certificate', 'Plantation Maintenance Staff Nyongoro', '5', '119', NULL, '4', '01/01/2022 - 12/31/2022', 'Employee: Comments\r\n\r\nThe company has provided key procedure in evaluating its employees effeciently and organizing to support workers has been encouraging. the evaluation was detailed and informing.\r\n\r\nSupervisor: Comments\r\n\r\nThe evaluation process was on mutual agreement and pointing out of areas to improve on. the staff was over willing to be more resourceful to the company. \r\n\r\nHOD: Comments\r\n\r\nSalim is well aware of his responsibility and tries to do well all duties assigned to him. some issues raised by him in the evaluation have been addressed (salary scale and bonuses for permanent staff etc) and issues relating to transport shall be addressed in due time by the management.', '2022-11-08 17:41:44', '2022-11-10 13:36:17'),
(136, 16, 'HOD reviewed', 'yearly', 'KCPE', 'Agroforestry Agent 7forks', '14', '6', 4, '4', '11/08/2022 - 08/11/2023', 'He has been akey player in the implementation of farmers program expecially group mobilization and also satellite nursery seedling production.\r\nHe is agood mobilizer in farmer group activities  and also passion in his job', '2022-11-08 19:58:45', '2022-11-12 19:25:02'),
(137, 5, 'HOD reviewed', 'yearly', 'diploma in forestry', 'Agroforestry Agent 7forks', '5.5', '6', 4, '4', '11/08/2021 - 08/11/2022', 'onesmus has played  an integral role in dormant group reaction that is currently ongoing. through his good mastery of the local language,he is able to interact with young and elderly in the groups', '2022-11-08 21:10:34', '2022-11-12 19:25:54'),
(138, 150, 'HOD reviewed', 'yearly', 'Primary level', 'Mr', '0.7', '70', 38, '8', '11/09/2022 - 11/09/2022', 'Null', '2022-11-09 09:04:38', '2022-11-15 18:34:09'),
(139, 110, 'HOD reviewed', 'yearly', 'KCSE', 'Plantation Maintenance Staff Nyongoro', '4', '119', NULL, '4', '01/01/2022 - 12/31/2022', 'Employee: Comments\r\n\r\nEvaluation of employees on various aspects was great to get more intrusive issues which affects employees. \r\n\r\nSupervisor: Comments\r\n\r\nEvaluation was informative and the staff responded positively on negative areas that needs improvements.\r\n\r\nHOD: Comments\r\n\r\nBarisa has gained some useful skills in forestry maintenance activities and seems eager to improve further on them so that he can perform better. He must however improve on his communication skills for him to effectively perform at the tasks assigned to him. He needs also to be open enough to point out issues that did not work well for him with regards to his supervisor.', '2022-11-09 10:33:49', '2022-11-10 13:52:58'),
(140, 13, 'HOD reviewed', 'yearly', 'Diploma in forestry', 'Agroforestry Agent 7forks', '4.5', '6', 4, '4', '11/09/2022 - 11/09/2022', 'James, has adapted well in his current duties. he has gained good rapport with farmers groups which for part has earned him a good standing ground in the community he serves.\r\n\r\nHe needs to improve on his planning and communication.', '2022-11-09 10:42:32', '2022-11-12 19:26:38'),
(141, 15, 'HOD reviewed', 'yearly', 'Diploma in forestry', 'Agroforestry Agent 7Forks', '4', '6', 4, '4', '11/01/2021 - 10/31/2022', 'The staff needs to improve on communication and attitude towards his jobs.  This can be achieved through commitment, monitoring and guidance by the supervisor.', '2022-11-09 12:21:31', '2022-11-12 19:27:05'),
(142, 105, 'HOD reviewed', 'yearly', 'Form IV', 'Tractor Driver Nyongoro', '5', '123', 38, '8', '11/13/2021 - 11/09/2022', '73/85', '2022-11-09 12:25:43', '2022-11-14 19:56:48'),
(143, 64, 'HOD reviewed', 'yearly', 'Kenya Certicate of Secondary Education', 'Plantation Maintenance Staff Kiambere', '0.5', '68', 33, '4', '11/09/2022 - 11/09/2022', 'The employee was identified to have several skills however needed to improve on punctuality in terms off reporting to work.', '2022-11-09 12:39:20', '2022-11-11 18:44:20');
INSERT INTO `extra_information` (`id`, `user_id`, `status`, `evaluation_type`, `Academic`, `Designation`, `service_years`, `review_supervisor`, `review_manager`, `review_hod`, `review_period`, `last_appraisal`, `created_at`, `updated_at`) VALUES
(144, 95, 'HOD reviewed', 'yearly', 'KCPE', 'Plantation Maintenance Staff Nyongoro', '5', '119', NULL, '4', '01/01/2022 - 12/31/2022', 'Employee: Comments\r\n\r\nThe evaluation was smooth and informative. I have learnt my weakensess and strengths from the laments made by my superviors.\r\n\r\nSupervisor: Comments\r\n\r\nEvaluation process was interactive, the staff acknowledged to understand all the question raised.  He was appreciative and pledged to be an assest to the company henceforth. \r\n\r\nHOD: Comments\r\n\r\nHe seems to have skills in all the maintenance activities. He also shows genuine concern for the state of the plantation by suggesting that we need to mechanise more for efficiency and faster maintenance intervention. Like the rest of his colleagues he needs to be made to get a deeper understanding on the importance of his job and how that relates to the company\'s mission and vision.', '2022-11-09 14:05:54', '2022-11-10 13:57:20'),
(145, 68, 'HOD reviewed', 'yearly', 'Bachelors of Science in Forestry', 'Forest Technician Kiambere', '2', '33', 33, '4', '01/01/2022 - 11/09/2022', 'Employee: Comments\r\n\r\nFirst I have to thank that management for the opportunity to join this team, towards achieving the company\'s objectives as I gain experience in my line of study.\r\n\r\nSecondly I have to admit during my probation period there were some gaps which were observed in relation to seedlings production which is the core in forestry. I didn\'t manage to achieve my set targets and objectives however through continuous training and interactions with my supervisor I have gained experience and can be entrusted with production and processing of Mukau seedlings and plantation maintenance activities.\r\n\r\nThirdly, I have to appreciate the PMS team I have at site who has been respectful and committed towards their work. Through their unity we have been able to surpass our set targets especially in cleaning activities.\r\n\r\nI look forward to incorporating the whole team including the security and even casual to work as a team and through this we will be able to achieve the company\'s vision and mission and set objectives for every departments.\r\n\r\nSupervisor: Comments\r\n\r\nThe employee joined the company this year. He started at a slow pace but he has since improved after training on both production and maintenance activities. Improvement has especially been noted in the plantation maintenance activities supervision. Continuous training ongoing, however he has a good attitude and he has shown ownership of the project. He is encouraged to continuously communicate for continuous improvement. He has shown honesty through reporting of actual situation on the ground and the correct figures.\r\n\r\nHOD: Comments\r\n\r\nRecently confirmed after probation, Osore was green newly from school, and inexperienced. However, a lot has changed. he has shown that he has the potential to become an accomplished technician. He is young and has been managing a staff that is way older than him. There is, however, still room for improvement with regards to management, precise communication, planning, and monitoring and budgeting.', '2022-11-09 14:45:19', '2022-11-14 14:50:39'),
(146, 112, 'HOD reviewed', 'yearly', 'Diploma-Electrical engineering', 'Plantation Maintenance Staff Nyongoro', '4', '119', NULL, '4', '01/01/2022 - 12/31/2022', 'Employee: Comments\r\n\r\nI am satisfied with the evaluation process, it has been a learning process to understand my weakness and with a promise to improve.\r\n\r\nSupervisor: Comments\r\n\r\nThe evaluation process was interactive, the staff showed much interest towards achieving company vision, mission and objectives. He understand his weakness with calmness and promise to improve and be an assest to the company henceforth.\r\n\r\nHOD: Comments\r\n\r\nOkumu seems to understand his job well. He also has other skills that are not forestry-related like welding and has a background in electrical engineering. This could be useful to the company in the near future. It also comes out clearly that for his future career development, he\'d be interested to do something that is not in forestry.', '2022-11-09 17:10:28', '2022-11-10 14:19:58'),
(147, 87, 'HOD reviewed', 'yearly', 'None', 'Security Guard Nyongoro', '6', '123', 38, '8', '11/01/2020 - 11/09/2022', 'Only vetting was done.', '2022-11-09 17:14:23', '2022-11-23 16:33:27'),
(148, 7, 'HOD reviewed', 'yearly', 'Diploma in forestry', 'Agroforestry Agent 7Forks', '5.5', '6', 4, '4', '11/01/2021 - 11/01/2022', 'William has improved in delivery of the program through farm visits, monitoring and verification. There is a need however for continuous communication and alot of self drive to improve for efficiency of the program', '2022-11-09 17:26:25', '2022-11-12 19:29:30'),
(149, 9, 'HOD reviewed', 'yearly', 'Diploma in Forestry.', 'Monitoring and Evaluation Officer', '5.5', '17', 8, '8', '10/11/2021 - 10/11/2022', 'Nelly is a passionate about the job. She has adapted well to the changes in her job. What is required for now is guidance in the internal policies and work instruction and trainings on using the corrective action system.\r\nOn tree verification, she has been in the field before therefore her interaction with farmers is not new to her. We hope to utilize this skill further in catching with forestry to verify all farms for correct tree stock.\r\nWe also encourage that solution on how to improve her work come from within.', '2022-11-09 19:31:38', '2022-11-14 13:37:43'),
(150, 55, 'HOD reviewed', 'yearly', 'Kenya Certificate of Secondary Education', 'Plantation Maintenance Staff Kiambere', '5', '68', 33, '4', '01/01/2022 - 11/10/2022', 'Employee: Comments\r\n\r\nFirst of all I thank the company for the opportunity and good relation so far. Through my daily activities as agreed by my supervisor I will strive to do my best and offer any suggestion necessary to help achieve the company\'s goals and objectives.\r\n\r\nLastly I would request the management company to consider this team in payment increment, life has not been easy and through this, workers will feel motivated and produce results as expected. \r\n\r\nSupervisor: Comments\r\n\r\nThe employee has been useful in tree counting where he has specialized in since he knows all the boundaries of the compartment. He indeed helped me to get to understand the whole of the plantation and where any special needs were required.  Through this we were able to achieve a lot in terms of maintenance since all these activities are core related. The gaps identified in terms of tree counting to get zero error has been agreed on and he is now aware that the company depends very much on the stock figures at all the time. \r\n\r\nHOD: Comments\r\n\r\nhe is skilled in all the maintenance activities within the plantation plus other activities in operations. this is a plus. He however was also part of the team that provided wrong tree counting information at the beginning of the year for whatever reason which is a huge non-conformance. It should also be noted that he acknowledges this by indicating that he needs continuous guidance and training on tree counting.', '2022-11-10 09:37:17', '2022-11-11 18:49:35'),
(151, 11, 'HOD reviewed', 'yearly', 'Diploma in Forestry', 'Agroforestry Agent 7Forks', '4.5', '6', 4, '4', '11/01/2021 - 10/31/2022', 'A lot need to be done for her efficiency to be maximized .Need for self drive and working on planing/general work enthusiasm will need to be prioritised', '2022-11-10 09:49:02', '2022-11-12 19:30:17'),
(152, 122, 'HOD reviewed', 'yearly', 'BSc. Forestry', 'Monitoring & Evaluation Officer', '3', '17', 17, '8', '11/08/2021 - 11/10/2022', 'M&E has become a pillar to the company\'s continuous improvement and the M&E impact on the company\'s activities is evident and has led a lot improvement. This is from your tireless efforts to make impact to the company.\r\n\r\nKeep it up.', '2022-11-10 09:57:23', '2022-11-28 10:38:07'),
(153, 108, 'HOD reviewed', 'yearly', 'KCSE', 'Plantation Maintenance Staff Nyongoro', '4', '119', NULL, '4', '01/01/2022 - 12/31/2022', 'Supervisor: Comments\r\n\r\nHashako is a good staff, ready to learn from mistakes and rectify. I am impressed with his work output, generally he is good. \r\n\r\nHOD: Comments\r\n\r\nHashako is well experienced in maintenance activities that are specific to forestry. He seems to be interested in improving in areas specific to forestry which is a good thing for the forestry department. However, his self-motivation is worrying and something that must be improved upon in the next working year for him to realize optimum or agreeable results by the company\'s standards.', '2022-11-10 10:05:56', '2022-11-10 14:28:49'),
(154, 22, 'HOD reviewed', 'yearly', 'Senior Four lever (Secondary school level)', 'Security', '4.4', '28', 38, '8', '11/10/2021 - 11/10/2022', '50/85', '2022-11-10 10:14:55', '2022-11-16 19:16:23'),
(155, 30, 'HOD reviewed', 'yearly', 'CPA, KAME', 'Accountant Head Office', '10', '37', 8, '8', '10/30/2021 - 11/01/2022', 'CAN DO BETTER, NEEED TO CONCENTRATE MORE ON THE SET OBJECTIVES', '2022-11-10 10:54:36', '2022-11-23 16:08:24'),
(156, 60, 'HOD reviewed', 'yearly', 'Primary level', 'Plantation Maintenance Staff Kiambere', '5', '68', 33, '4', '01/01/2022 - 11/10/2022', 'Employee: Comments\r\n\r\nFirst I have to thank the company for this far . Indeed this company has enabled me to achieve a lot in my personal daily activities and even during this covid outbreak most companies laid off workers but we have been at work all through. \r\n\r\nThe last thing i would like the company to check on the welfare of the workers in terms of salary increments\r\n\r\nSupervisor: Comments\r\n\r\nThe employee has been committed to his work for the time I have known him. He is an old man but is willing to listen to any instruction given to him and has no issue despite the age differences. He has been willing to be assigned any duty and works with minimal supervision.\r\n\r\nHOD: Comments\r\n\r\nHe has been involved in cleaning which has improved over time. He however was part of a cleaning team that needed close supervision at the beginning of the year which is an unacceptable trait on the job.', '2022-11-10 11:02:07', '2022-11-11 18:52:39'),
(157, 89, 'HOD reviewed', 'yearly', 'Class 8', 'Security Guard Nyongoro', '6', '123', 38, '8', '11/10/2021 - 11/10/2022', 'Only Vetting was done', '2022-11-10 11:21:45', '2022-11-23 16:34:04'),
(158, 24, 'HOD reviewed', 'yearly', 'Crime preventer affiliated to the Uganda Police', 'Security', '4.9', '28', 38, '8', '11/10/2021 - 11/10/2022', '68/85', '2022-11-10 12:49:10', '2022-11-16 19:18:07'),
(159, 120, 'HOD reviewed', 'yearly', 'Class 7', 'Security Guard Nyongoro', '5', '123', 38, '8', '11/10/2021 - 11/10/2022', 'Only vetting done', '2022-11-10 13:07:22', '2022-11-23 16:34:29'),
(160, 111, 'HOD reviewed', 'yearly', 'KCSE', 'Plantation Maintenance Staff Nyongoro', '4', '119', 33, '4', '01/01/2022 - 12/31/2022', 'Employee: Comments\r\n\r\nAccording to my point of view evaluation was fair and i do thank my supervisor and the entire company for the chance granted.\r\n\r\nSupervisor: Comments\r\n\r\nImproved on having sense of self assessment, he understands his weaknesses and committed to correct where necessary in order to get work efficiency. He needs to improve on attitude towards achieving set targets.\r\n\r\nHOD: Comments\r\n\r\nsome issues raised like transport for workers is being looked upon by the management and shall be addressed in due time as it is not as straightforward as it appears. Salary increment is not automatic.', '2022-11-10 13:38:39', '2022-11-12 15:32:08'),
(161, 127, 'HOD reviewed', 'yearly', 'BSC. NATURAL RESOURCES MANAGMENT', 'Monitoring & Evaluation Officer  GIC', '5', '6', 4, '4', '11/01/2021 - 10/31/2022', 'The effort exhibited by team is remarkable partly due to January\'s persistence. His good team playing ability and deliverance of GIC main mandate of greening schools is extemporal.  However, there is a need to improve his communication skill for the betterment of his career.', '2022-11-10 13:52:36', '2022-11-12 19:29:54'),
(162, 62, 'HOD reviewed', 'yearly', 'Primary level', 'Plantation Maintenance Staff Kiambere', '5', '68', 33, '4', '10/11/2021 - 11/10/2022', 'Employee: Comments\r\n\r\nFirst I have to thank the company for this far . Indeed this company has enabled me to achieve a lot in my personal daily activities and even during this covid outbreak most companies laid off workers but we have been at work all through. I am committed towards my work and I will always strive towards achieving my assigned duties as already agreed upon by the supervisor.\r\n\r\nThe only thing I would request is to be given certificate for any training done example Building Construction, Carpentry, power saw handling e.t.c\r\n\r\nSupervisor: Comments\r\n\r\nThe employee has been committed to his work for the time I have known him, He however had weakness at the beginning of the year in terms of attaining pruning task rate where the excuse was the type of pruning saws were not good. However after provision of the tools, he indeed changed and always surpass the task rate. He is ready to accept his weakness and change towards achieving better results.\r\n\r\nHOD: Comments\r\n\r\nHe has been involved in various activities in the plantation apart from the maintenance activities. At some point at the beginning of the year, there was lux in commitment to work without close supervision by the team in pruning and cleaning. this has since changed. Some issues raised especially in HR on salary have since been addressed by the HR.', '2022-11-10 14:00:40', '2022-11-12 16:03:33'),
(163, 128, 'pending', 'yearly', 'Bsc. Environmental sciences', 'Monitoring & Evaluation officer GIC', '4.8', '6', NULL, NULL, '11/01/2021 - 10/31/2022', 'Samuel has been a strong implementer and a believer of the schools green initiative  challenge. Through his team  building skills and self drive, the initiative has complimented his team with a good survival in the phases prior.', '2022-11-10 14:07:25', '2022-11-10 14:07:25'),
(164, 128, 'HOD reviewed', 'yearly', 'Bsc. Environmental sciences', 'Monitoring & Evaluation officer GIC', '4.8', '6', 4, '4', '11/01/2021 - 10/31/2022', 'Samuel has been a strong implementer and a believer of the schools green initiative  challenge. Through his team  building skills and self drive, the initiative has complimented his team with a good survival in the phases prior.', '2022-11-10 14:07:28', '2022-11-12 19:29:00'),
(165, 102, 'HOD reviewed', 'yearly', 'Class 8', 'Security Guard Nyongoro', '5', '123', 38, '8', '11/10/2021 - 11/10/2022', 'Only vetting was done', '2022-11-10 14:34:42', '2022-11-23 16:35:32'),
(166, 44, 'HOD reviewed', 'yearly', 'Kenya Certificate of Secondary Education', 'Plantation Maintenance', '5', '68', 33, '4', '10/11/2021 - 11/10/2022', 'Employee: Comments\r\n\r\nFirst I have to thank the company for this far . Indeed this company has enabled me to achieve a lot in my personal daily activities and even during this covid outbreak most companies laid off workers but we have been at work all through. I am committed towards my work and I will always strive towards achieving my assigned duties as already agreed upon by the supervisor.\r\n\r\nLastly I would request the management team to consider making value of the trees which we do record as dead and windthrows from different compartments instead of letting them rot in the plantation.\r\n\r\nSupervisor: Comments\r\n\r\nThe employee has been committed to his work for the time I have known him. He is well conversant with the whole compartments and has been useful for the interns currently in doing tree measurement. He is flexible and after training can do any chores required. \r\n\r\nHOD: Comments\r\n\r\nJosphat has shown that he has immense knowledge of the Kiambere plantation and knows all the compartments by heart. However being part of the tree counting team, it must be noted that we got wrong figures at the beginning of the year due to incomplete counting and non-communication about areas that need to be cleaned before the tree counting is done.', '2022-11-10 15:24:10', '2022-11-12 16:10:01'),
(167, 23, 'HOD reviewed', 'yearly', 'Chief Instructor/Training Officer in Security', 'Security', '4.9', '28', 38, '8', '11/10/2021 - 11/10/2022', '52.5/85', '2022-11-10 16:29:58', '2022-11-16 19:20:36'),
(168, 86, 'HOD reviewed', 'yearly', 'None', 'Security Guard Nyongoro', '6', '123', 38, '8', '11/10/2020 - 11/10/2022', 'Only Vetting Done', '2022-11-10 16:54:08', '2022-11-23 16:36:27'),
(169, 56, 'HOD reviewed', 'yearly', 'Primary level', 'Plantation Maintenance Staff Kiambere', '7', '68', 33, '4', '10/11/2022 - 11/10/2022', 'Employee: Comments\r\n\r\nFirst I have to thank the company for this far . Indeed this company has enabled me to achieve a lot in my personal daily activities and even during this covid outbreak most companies laid off workers but we have been at work all through. I am committed towards my work and I will always strive towards achieving my assigned duties as already agreed upon by the supervisor.\r\n\r\nSupervisor: Comments\r\n\r\nThe employee has been resourceful in the plantation activities. He has specifically taken part in tree marking of the years being that he was there from the time of establishments. He has helped other workers in getting to know the whole plantation.\r\n\r\nHOD: Comments\r\n\r\nHe has acquired various skills apart from maintenance activities. Efforts by HR in explaining issues have clearly had a positive effect and he now sees the company in a positive light. He clearly shows concern about the plantation. He however was still part of the PMF team that did not provide the correct figures at the beginning of the year. It should also be noted that it is ok to pray but even prayers have their place and time on Sundays.', '2022-11-10 17:25:08', '2022-11-11 18:48:15'),
(170, 119, 'HOD reviewed', 'yearly', 'Bsc in Forestry', 'Site Manager Plantation Nyongoro', '3.5', '33', 33, '4', '01/01/2022 - 12/31/2022', 'Employee: Comments\r\n\r\nThe discussion was detailed and informative in terms of pointing out areas to improve on in order to achieve impressive results. \r\n\r\nSupervisor: Comments\r\n\r\nFor the year, Stephen concentrated on maintenance and plantation stock verification exercise. From this exercise he has been able to streamline his team to be more accountable about the figures of all activities they undertake and of the stocks. Mortality was still a problem in the  plantation due to different causes including buffaloes damage. However, going forward it is expected that the team will work towards zero mortality and some measures are already being put in  place such an electric fence round the plantation. \r\n\r\nHe is also expected to make better plans based on the reality on the ground and have periodic checks (daily, weekly, monthly, quarterly and yearly) to ensure the company meets the sites objectives thereby achieving its mission and vision. \r\n\r\nHOD: Comments\r\n\r\nStephen has shown great technical skills in plantation forestry by managing to learn fast and adapting on the job. He has been able to manage people in a difficult environment with all kinds of challenges from the community and the wild animals. This is commendable. However, these qualities should now be channeled into giving the desired results of zero mortality in the plantation. He, therefore, needs to improve in the following areas:\r\n\r\n1. Planning and continuous monitoring. Managing a plantation is not just about field work, but also thorough planning and continuous checks to ensure the activities are implemented and correctly.\r\n\r\n2. Be more open to criticism and take it positively as an opportunity for improvement.\r\n\r\n3. Communication\r\n\r\n4. Be tougher with your team, pointing out their mistakes and punishing these mistakes as per the HR policy rather than trying to be nice to them or protecting them and ending up taking blame for other peoples mistakes.', '2022-11-10 17:54:56', '2022-11-14 15:14:55'),
(171, 134, 'HOD reviewed', 'yearly', 'Class 8 & 4 Yrs NYS.', 'Security Guard Nyongoro', '5', '123', 38, '8', '11/10/2021 - 11/10/2022', 'Only Vetting Was Done.', '2022-11-10 17:56:51', '2022-11-23 16:38:00'),
(172, 151, 'HOD reviewed', 'yearly', 'Primary Level', 'Security guard', '7', '70', 38, '8', '11/11/2022 - 11/11/2022', 'N/A', '2022-11-11 08:46:22', '2022-11-15 18:35:58'),
(173, 32, 'HOD reviewed', 'yearly', 'Degree in Hospitality', 'Deputy Director Communications', '4', '130', NULL, '137', '03/10/2021 - 11/11/2022', 'You are very much on the way to mastering the communication requirements of BGF. It is a matter of continuous improvement of the skills, the ability to develop and use newly developed tools, to get knowledge, but most of all to relate with people, listen to them, understand them and use that knowledge to make them communicate up, down and other directions the right way first time every time. This is already saving the company huge costs and it will even become more critical as we grow.\r\nKeep on the good work!', '2022-11-11 10:11:39', '2022-11-26 15:52:22'),
(174, 52, 'pending', 'yearly', 'Primary Level', 'Security Guard Kiambere', '5', '70', NULL, NULL, '01/01/2022 - 11/11/2022', 'N/A', '2022-11-11 10:23:10', '2022-11-11 10:23:10'),
(175, 98, 'HOD reviewed', 'yearly', 'KCSE', 'Plantation Maintenance Staff Nyongoro', '5', '119', 33, '4', '01/01/2022 - 12/31/2022', 'Employee: Comments\r\n\r\nEvaluation was good, It has showed me areas of strength, weaknesses as well as areas to improve on. Thanks to my supervisor for the support he has provided to me since beginning of the year that has enabled be perform my duties efficiently. Thanks to the management and entire company for standing with us during COVID 19.\r\n\r\nSupervisor: Comments\r\n\r\nBakari is a polite, humble and hard working staff. He is among the top rated PMS interims of performance, truly he is a right guy to work with. \r\n\r\nHOD: Comments\r\n\r\nBakari is a well-trained personnel in pruning plus other maintenance activities. Some issues raised in the evaluation relating to HR, bonuses and salary have been addressed by the HR department in previous interactions. He should also seek to develop more skills for plantation management (like cleaning, plant protection, thinning etc) instead of nursery.ek to develop more skills for plantation management (like cleaning, plant protection, thinning etc) instead of nursery.', '2022-11-11 11:09:46', '2022-11-11 18:38:32'),
(176, 152, 'completed', 'yearly', 'Primary Level', 'Security guard', '7', '70', NULL, NULL, '01/01/2022 - 11/11/2022', 'N/A', '2022-11-11 12:02:23', '2023-02-01 13:24:35'),
(177, 6, 'HOD reviewed', 'yearly', 'Diploma in Agriculture and Biotechnology', 'Site Manager Farmers Program', '6', '4', NULL, '4', '11/01/2021 - 10/31/2022', 'Staff is well self-motivated and has positive attitudes towards the farmers program, though need to:  have all farmers in active groups, improve on planning and organization, improve on data analysis and manipulation particularly excel and also gear towards completion of group verification which provides reliable information about farmer groups.', '2022-11-11 13:04:18', '2022-11-11 18:35:33'),
(178, 113, 'HOD reviewed', 'yearly', 'KCSE', 'Plantation Maintenance Staff Nyongoro', '4', '119', 33, '4', '01/01/2022 - 12/31/2022', 'Employee: Comments\r\n\r\nEvaluation was good, It has showed me areas of improvement as well as areas I\'ve performed extremely  good.  Thanks to my Supervisor. Not forgetting to thank the company and its management for standing with its employee during this time of Pandemic.  \r\n\r\nSupervisor: Comments\r\n\r\nMtawali Karisa is one among the best PMS interims discipline, Honesty, team work, hardworking and general performance.  \r\n\r\nHOD: Comments\r\n\r\nHe seems well trained and has the right attitude towards the job.\r\n\r\nHe should not however that the company shall not provide transport from their homes to the workplace but in the future, there are prospects for providing transport between the nursery and the plantations.', '2022-11-11 13:33:31', '2022-11-12 19:28:10'),
(179, 143, 'HOD reviewed', 'yearly', 'Kenya certificate of secondary education', 'Security Guard KIA', '0.7', '70', 38, '8', '08/03/2022 - 11/11/2022', 'Employee: Comments\r\n\r\nFirstly, I must thank the company for this opportunity for allowing me to join Kiambere team and I appreciate the whole team in Kambere as well for good orientation and for ensuring I got a better training to deliver the roles am expected to deliver as one of the security personnel.\r\n\r\n \r\n\r\nI look forward to improving on the identified gaps during this discussion to ensure we protect the whole plantation as a team, and the planted trees survives.\r\n\r\n \r\n\r\nLastly the suggestion I would like to make is if it’s possible to cut down the Baobab tree next to the site office, which is destroying the office’s roof. The branch of the tree normally brakes off easily and this has been hitting the iron sheet which I think will destroy the roof.\r\n\r\n\r\nSupervisor: Comments\r\n\r\n The employee has a potential of working as a security guard and for the past three months he has been able to understand the whole plantation including different   compartments/blocks.\r\n\r\n He however needs to work hand in hand with the whole security team to prevent cases of theft which we have observed in site for the past one month.\r\n\r\n\r\n The employee also needs to improve on his communication since most of the mistake recorded in site are because of communication breakdowns in site.\r\n\r\n\r\nHOD: Comments\r\n\r\nThe above Employee is good in his duties however he needs improve on the points scored 3 and below. He also needs to improve on performance based on the discussion during the evaluation. He has the potential and can do Better.\r\n\r\nThe security as a whole needs training on Security.\r\n\r\nWe recommend him for the JOB.', '2022-11-11 13:47:14', '2022-11-15 18:37:36'),
(180, 76, 'HOD reviewed', 'yearly', 'Kenya Certificate of secondary Education', 'Security Guard', '1', '70', 38, '8', '11/11/2022 - 11/11/2022', 'N/A', '2022-11-11 15:42:34', '2022-11-15 18:41:05'),
(181, 1, 'HOD reviewed', 'yearly', 'BSc Mathematics and computer science', 'Information Security Manager', '3', '137', 137, '137', '11/01/2021 - 11/01/2022', 'Michael has done a great job in integrating into BGF and taking responsibility for challenging tasks. We will support his drive and together find a balance between performing (creating new applications) and learning which we agree is absolutely necessary.\r\nIt is also observed that he has a vision for the future that matches the direction in which the company needs to go.', '2022-11-11 15:57:34', '2022-11-11 17:40:31'),
(182, 94, 'HOD reviewed', 'yearly', 'KCSE', 'Plantation Maintenance Staff Nyongoro', '5', '119', 33, '4', '01/01/2022 - 12/31/2022', 'Employee: Comments\r\n\r\nThanks to my supervisor for always being there for assistance in order to achieve my tasks. Special thanks to my collogues, department as well as the entire organization for the effort and assistance to ensure the plantation is maintained. Trainings has been conducted sufficiently.  \r\nSupervisor: Comments\r\n\r\nShadrack is a hardworking staff, dedicated and always ready to learn and improve. His performance is amazing and I enjoyed working with him.\r\n\r\nHOD: Comments\r\n\r\nHe seems ok with skills in all maintenance activities. He needs to be explained to and to understand why there are deductions.', '2022-11-11 16:01:16', '2022-11-12 15:54:41'),
(183, 2, 'HOD reviewed', 'yearly', 'Ongoing BBA With IT', 'Information & Administration Manager', '2.9', '137', 137, '137', '11/11/2022 - 11/11/2022', 'Alex has proven a valuable asset and he has grown in a job that was new in the first place. He has integrated perfectly in BGF and his support in matters of APP implementation, trainings, support and testing have hugely benefitted the company.', '2022-11-11 17:45:59', '2022-11-11 18:51:58'),
(184, 59, 'HOD reviewed', 'yearly', 'Primary Level', 'Plantation Maintenance Staff Kiambere', '5', '68', 33, '4', '10/11/2022 - 11/11/2022', 'Employee: Comments\r\n\r\nFirst I have to thank the company for this far . Indeed this company has enabled me to achieve a lot in my personal daily activities and even during this covid outbreak most companies laid off workers but we have been at work all through. I am committed towards my work and I will always strive towards achieving my assigned duties as already agreed upon by the supervisor.\r\n\r\n\r\nSupervisor: Comments\r\n\r\nThe employee has potential in doing hi work. He had some weakness at the beginning of the year in terms of task rates management but is ready for improvement. He has agreed to improve in his weakness and through training in tree counting will be able to perform the task.\r\n\r\nHOD: Comments\r\n\r\nLike the rest of the PMS, he has been involved in various maintenance activities in which he is skilled. These have been done well. It is however should be noted that Mutemi was still part of the maintenance team that did not give correct figures at the beginning of the year. He must therefore ensure that this doesn\'t happen again in the future by understanding why it is a must that correct information is submitted.', '2022-11-11 18:17:21', '2022-11-14 10:52:18'),
(185, 92, 'HOD reviewed', 'yearly', 'KCPE', 'Plantation Maintenance Staff Nyongoro', '6', '119', 33, '4', '01/01/2022 - 12/31/2022', 'Employee: Comments\r\n\r\nEvaluation was good. My strengths and weakneses revealed in the process and also areas of improvement showed. Thanks to my suppervisor for standing with me and supporting me in all aspects related to my job. Thanks to the company for standing with me and other employees during this hard strike time CORONA Pandemic.  \r\nSupervisor: Comments\r\n\r\nWalter is a all round, informed, honest, reliable and hard working employee. He is among the best performing curently i have on site. He has been constantly requested by other departments within the company for assigning of special tasks due to his competencies. He is encouraged to continue with the same spirit of job he has established.\r\n\r\nHOD: Comments\r\n\r\nWalter is versatile and multiskilled in activities relating to both forestry and operations. He should however be able to honestly point out things that are not ok and need to improve even if it is about his supervisor.', '2022-11-11 18:39:02', '2022-11-14 11:09:32'),
(186, 63, 'HOD reviewed', 'yearly', 'Primary Level', 'Plantation Maintenance Staff Kiambere', '5', '68', 33, '4', '10/11/2021 - 11/12/2022', 'Employee: Comments\r\n\r\nFirst I have to thank the company for this far . Indeed this company has enabled me to achieve a lot in my personal daily activities and even during this covid outbreak most companies laid off workers but we have been at work all through. I am committed towards my work and I will always strive towards achieving my assigned duties as already agreed upon by the supervisor.\r\n\r\nSupervisor: Comments\r\n\r\nThe employee has been committed to his work for the time I have known him, He however had weakness at the beginning of the year in terms of attaining pruning task rate where the excuse was the type of pruning saws were not good. However after provision of the tools, he indeed changed and always surpass the task rate. He is ready to accept his weakness and change towards achieving better results.\r\n\r\nHOD: Comments\r\n\r\nHe has been involved in various activities in the plantation for both forestry and operations. It is clear that he needs to improve on his punctuality as this could be an indicator of a bigger problem.', '2022-11-12 10:20:48', '2022-11-14 10:57:49'),
(187, 65, 'HOD reviewed', 'yearly', 'Primary Level', 'Plantation Maintenance Staff Kiambere', '6', '68', 33, '4', '10/11/2021 - 11/12/2022', 'Employee: Comments\r\n\r\nFirst I have to thank the company for this far . Indeed this company has enabled me to achieve a lot in my personal daily activities and I have managed to educate my three children just from the resources I get from the company. I am and will always be committed towards achieving by assigned task and willing to improve on any gasps as identified.\r\n\r\nSupervisor: Comments\r\n\r\nThe employee is very committed to his work. He has been willing to follow instruction and always advocates for unity among the other workers for effective performance. He is always ready for improvement and willing to work.\r\n\r\nHOD: Comments\r\n\r\nHe has been part of the cleaning team. This has since improved in the Kiambere plantation which is an indicator of recent good effort by individual staff in the cleaning team. However, like the rest of the cleaning team, it should be noted here that at the beginning of the year, there was provision of wrong data of the results and some cases of laxity.', '2022-11-12 12:29:02', '2022-11-14 10:59:32'),
(188, 91, 'HOD reviewed', 'yearly', 'KCSE', 'Plantation Maintenance Staff Nyongoro', '6', '119', 33, '4', '01/01/2022 - 12/31/2022', 'Employee: Comments\r\n\r\nThe evaluation process was informative and i have noted my strengths and weaknesses with a lot of concern. Much appreciation to the company for believing and giving me a chance to display my strengths.\r\n\r\nSupervisor: Comments\r\n\r\nThe evaluation process was smooth and to detailed, the staff showed a lot of interest on actualizing the vision and mission of the company. He was too passionate on forestry practice.\r\n\r\nHOD: Comments\r\n\r\nBased on the evaluation, he seems to be self-driven and handles all the tasks given to him well.', '2022-11-12 13:01:56', '2022-11-14 11:15:51'),
(189, 153, 'HOD reviewed', 'yearly', 'Primary Level', 'Security guard', '1', '70', 38, '8', '03/07/2022 - 11/12/2022', 'N/A', '2022-11-12 13:22:57', '2022-11-15 18:44:46'),
(190, 66, 'HOD reviewed', 'yearly', 'Form Four Level', 'Plantation Maintenance Staff Kiambere', '6', '68', 33, '4', '10/11/2022 - 11/12/2022', 'Employee: Comments\r\n\r\n\r\n\r\nFirst I have to thank the company for this far . Indeed this company has enabled me to achieve a lot in my personal daily activities and even during this covid outbreak most companies laid off workers but we have been at work all through. I am committed towards my work and I will always strive towards achieving my assigned duties as already agreed upon by the supervisor.\r\n\r\n\r\nSupervisor: Comments\r\n\r\nThe employee has been committed to his work for the time I have known him, He however had weakness at the beginning of the year in terms of attaining pruning task rate where the excuse was the type of pruning saws were not good. However after provision of the tools, he indeed changed and always surpass the task rate. He is ready to accept his weakness and change towards achieving better results.\r\n\r\nHOD: Comments\r\n\r\nHe has been involved in both forestry work and operations activities. it should also be noted that he helped in the set up of a trial for the PhD student which has since been a success with over 90% survival. Issues raised regarding salary have already been addressed by the HR department in recent interactions.', '2022-11-12 14:55:18', '2022-11-14 11:01:53'),
